question,answer
How can I enable rate limiting for an API?,"To enable rate limiting for an API in Choreo, follow these steps:\n\n1. In the **Component Listing** pane, click on the component for which you want to apply rate limiting.\n2. In the left navigation menu, click **Deploy**.\n3. Go to the required environment card and click the view icon corresponding to the endpoint for which you want to apply rate limiting.\n   - **Note**: If you are applying rate limiting for an API Proxy component, click the setting icon corresponding to **API Configuration** instead.\n4. In the **Endpoint Details** pane that opens, click the settings icon.\n5. In the **Manage** section, click **Rate Limiting** to expand it.\n6. Select a **Rate Limiting Level** based on your requirements and click **Apply**.\n\nYou can apply rate-limiting settings separately for each environment, allowing for flexibility based on different deployment scenarios.\n\nFor more detailed information on API rate limiting, you can refer to the official documentation [here](https://wso2.com/choreo/docs/api-management/api-rate-limiting/#enable-rate-limiting-for-an-api)."
How do I change API visibility?,"To change the visibility settings of an API in Choreo, follow these steps:\n\n1. In the **Component Listing** pane of the Choreo Console, click on the REST API (Service) for which you want to control the visibility.\n2. In the left navigation menu, click **Manage** and then select **API Info**.\n3. On the **API Info** page, navigate to the **Developer Portal** tab.\n4. Under **General Details**, find the **Visibility** list and select the desired visibility option. The available options are:\n   - **Public**: The API is visible to everyone in the Developer Portal.\n   - **Private**: The API is visible only to users who are signed in to the Developer Portal.\n   - **Restricted**: The API is visible only to users with specific roles that you can define.\n\n5. If you select **Restricted**, you will be able to specify which roles can access the API. You can choose from existing roles or create a new one by clicking **+ Create New Role**, providing the role name and description, assigning permissions, and then saving it.\n\n6. After making your selection, click **Save** to apply the changes.\n\nBy managing the API's visibility settings, you can control access to your API based on your requirements, ensuring that only the intended users or roles can view or interact with it.\n\nFor more details, you can refer to the documentation [here](https://wso2.com/choreo/docs/api-management/control-api-visibility/#change-api-visibility)."
How can I add documents to an API?,"To add documentation to an API in Choreo, you can follow these steps:\n\n1. In the **Component Listing** pane, click on the API component for which you want to add documents.\n2. In the left navigation menu, click on **Manage**, and then select **Documents**.\n3. Specify a title for the document and provide the content using markdown syntax.\n4. Click **Add** to save the document.\n\nYou can add one or more documents depending on the information you need to provide. Additionally, you have the option to edit existing documents and delete them if necessary.\n\nThis documentation helps API consumers understand details like how to invoke the API, any limitations or restrictions, and more, which improves the overall visibility and usability of your API.\n\nFor more detailed information, you can refer to the documentation [here](https://wso2.com/choreo/docs/api-management/documents/#add-documents-to-an-api)."
What are the different API lifecycle states in Choreo?,"In Choreo, the API lifecycle consists of six distinct states that an API progresses through, which are crucial for managing the API's availability and usability. Here are the different API lifecycle states:\n\n1. **CREATED**: \n   - The API is created but is not ready for consumption.\n   - The API is not visible to subscribers in the Developer Portal.\n\n2. **PRE-RELEASED**: \n   - A prototype is created for early promotion and consumer testing.\n   - The API is published to the Developer Portal as a pre-release.\n\n3. **PUBLISHED**: \n   - The API is ready for subscribers to view and subscribe to via the Developer Portal.\n   - The API is visible in the Developer Portal and is available for subscription.\n\n4. **BLOCKED**: \n   - Access to the API is temporarily blocked.\n   - Runtime calls are blocked, and the API is not visible in the Developer Portal.\n\n5. **DEPRECATED**: \n   - The old version of an API is moved to this state when a newer version of the API is published.\n   - The API is available to existing subscribers, while new subscriptions are disabled.\n\n6. **RETIRED**: \n   - The API is no longer in use when it is in this state.\n   - The API is unpublished and deleted from the Developer Portal.\n\nBy understanding these states, API managers can optimize the development process and ensure that subscribers have access to the latest and most reliable APIs.\n\nFor more detailed information, you can refer to the documentation [here](https://wso2.com/choreo/docs/api-management/lifecycle-management/#api-lifecycle-states)."
How do I rename the API display name?,"To update or change the display name of an API in the Choreo Console, follow these steps:\n\n1. In the **Component Listing** pane, click on the component for which you want to rename the API display name. This will open the **Overview** page of the component.\n2. In the left navigation menu, click on **Manage** and then select **API Info**.\n3. On the **API Info** page that opens, click the **Developer Portal** tab.\n4. Under **General Details**, find the **Name** field and specify the new display name for your API.\n5. Click **Save** to apply the changes.\n\nOnce you save the new display name, it will be immediately updated and displayed in the Choreo Developer Portal.\n\nFor more detailed information, you can refer to the documentation [here](https://wso2.com/choreo/docs/api-management/rename-api-display-name/)."
How can I apply advanced settings on mediation policies?,"To apply advanced settings on mediation policies for a proxy component in Choreo, follow these steps based on the deployment status of the component:\n\n### Steps to Configure Advanced Settings\n\n1. **Access the Proxy Component**:\n   - In the **Component Listing** pane, click on the REST API Proxy component for which you want to configure advanced settings.\n\n2. **Navigate to Deployment Options**:\n   - In the left navigation menu, click on **Deploy**.\n\n3. **Determine Deployment Status**:\n   - **If the proxy component is not deployed**: \n     - Go to the **Set Up** card and click **Configure & Deploy**.\n   - **If the proxy component is already deployed**: \n     - Go to the corresponding environment card based on where you want to apply the advanced settings, and then click the **Environment Variables** icon.\n\n4. **Configure Advanced Settings**:\n   - In the **Configurations** pane that opens, expand the **Defaultable Configurables** section.\n   - In the **Advanced Settings** field, configure the necessary settings. Here are some of the advanced settings you can apply:\n\n   | **Setting**                     | **Purpose**    | **How to apply**  | **Impact**   |\n   |---------------------------------|----------------|-------------------|--------------|\n   | **HTTP version**                | Change the HTTP version (default is 1.1) | Specify the required HTTP version in the **Advanced Settings** field. | The application will use the specified HTTP version for backend interactions.  |\n   | **Hostname verification**       | Control hostname verification during mTLS | Set the `verifyHostname` parameter to `false`. | Skips hostname verification. |\n   | **Minimum evictable idle time** | Sets idle time for outgoing connections | Specify the idle time in seconds in the **Advanced Settings** field. | Closes idle connections after the defined period. |\n   | **Detailed access log**         | Enable or disable detailed logs for the mediation application | Set the `detailedAccessLog` parameter in the **Advanced Settings** field. | Logs related to the mediation application will not be generated if disabled. |\n\n5. **Save Changes**:\n   - Click **Save & Deploy** to apply the configurations.\n\n### Additional Information\nFor more details on attaching mediation policies to a proxy component, you can refer to the [Attach and Manage Policies](https://wso2.com/choreo/docs/api-policies/attach-and-manage-policies) documentation. For a comprehensive understanding of advanced settings, you may check the [Apply Advanced Settings on Mediation Policies](https://wso2.com/choreo/docs/api-management/api-policies/apply-advanced-settings-on-mediation-policies/) documentation.\n\nThis process allows you to customize how your service interacts with backend systems, ensuring optimal performance and security."
How do I attach and manage API policies?,"To attach and manage API policies in Choreo, follow these steps:\n\n### Attaching a Policy\n\n1. **Select Your Component**: In the **Component Listing** pane, click on the REST API Proxy component for which you want to attach a policy.\n2. **Navigate to Policies**: In the left navigation menu, click on **Develop**, then click on **Policies**.\n3. **Expand Resource**: From the list of resources, expand the resource to which you want to attach the policy.\n4. **Attach Policy**: Click **Attach Mediation Policy** in the respective flow (Request, Response, or Error) where you want to attach a policy.\n5. **Choose Policy**: In the **Policy List** pane that opens, click on a required policy to view its details.\n6. **Configure Parameters**: If the attached policy requires parameter configuration, enter the appropriate values in the policy pane. You can make a parameter configurable by using the `${<variableName>}` format.\n   ![Configure parameters](https://wso2.com/choreo/docs/assets/img/api-management/api-policies/configure-parameters.png)\n7. **Add Policy**: To attach the policy, click **Add**.\n\n### Deploying the API\n\nAfter attaching an API Policy, you need to deploy the API for the policy to take effect:\n\n1. **Deploy Configuration**: In the left navigation menu, click **Deploy**, then click **Configure & Deploy**. This opens the **Configure & Deploy** pane.\n2. **Specify Configurable Values**: If you have any configurable variables that require values, specify the appropriate values.\n   ![Save and deploy values](https://wso2.com/choreo/docs/assets/img/api-management/api-policies/save-and-deploy.png)\n3. **Final Deployment**: Click **Save & Deploy**.\n\n### Managing Policies\n\n- You can attach multiple policies to a single API proxy component.\n- If necessary, you can rearrange or swap the policies you attach.\n- The deployment process involves creating a mediation application that is then built and deployed.\n\n### Behavior Modifications\n\nWhen a mediation policy is attached, it modifies the behavior of API invocations:\n- **Request Flow**: Policies execute on the request before it reaches the backend.\n- **Response Flow**: Policies execute on the response from the backend before it reaches the client.\n- **Error Flow**: Policies execute in case of errors, modifying the error response sent to the client.\n\nFor a detailed guide on attaching and managing API policies, refer to the documentation here: [Attach and manage mediation policies](https://wso2.com/choreo/docs/api-management/api-policies/#attach-and-manage-mediation-policies)."
How do I assign subscription plans to APIs?,"To assign subscription plans to APIs in Choreo, follow these steps:\n\n1. In the **Component Listing** pane, click on the API component for which you want to assign subscription plans.\n2. In the left navigation menu, click **Manage** and then select **Subscription Plans**. This will display the subscription plans available for that API component.\n3. Enable the **Subscription Plan Status** toggle for the subscription plans you wish to assign to the API. \n\n   ![Enable toggle](https://wso2.com/choreo/docs/assets/img/api-management/manage-api-traffic/enable-toggle.png)\n\n4. Click **Save**.\n\nOnce the subscription plans are assigned to the API, consumers will be able to select the appropriate plan that suits their needs during the subscription process.\n\nFor additional information on how to create subscription plans, you can refer to the [Create API Subscription Plans](https://wso2.com/choreo/docs/administer/create-api-subscription-plans) documentation. \n\nFor details on how consumers can subscribe to an API with a subscription plan, visit [Subscribe to an API with a Subscription Plan](https://wso2.com/choreo/docs/api-management/manage-api-traffic/subscribe-to-an-api-with-a-subscription-plan/)."
How can I subscribe to an API with a specific subscription plan?,\nI currently do not have information about subscription plans for APIs in Choreo. Would you like me to help you with something else?
How do I configure mutual TLS between components in Choreo?,"To configure mutual TLS (mTLS) between components in Choreo, you need to follow a series of steps to generate the necessary certificates and set up the communication. Here's a structured overview of the process:\n\n### 1. Understanding Mutual TLS\nMutual TLS is a security protocol that enables both the client and server to authenticate each other using digital certificates. This ensures privacy, integrity, and authentication of the data exchanged between them.\n\n### 2. Generate Certificates\nYou will need to create the following certificates:\n\n- **Root Certificate**: This is a trusted certificate used to verify other certificates during the mTLS handshake. You can generate a root certificate using tools like OpenSSL.\n  \n- **Client Certificate**: This certificate identifies the client. Ensure that the common name (CN) in the certificate correctly represents the client's identity, and it must be signed by the root certificate.\n  \n- **Server Certificate**: This certificate is used by clients to verify the server's identity. Similar to the client certificate, it must also be signed by the root certificate. When generating the server certificate, specify the server's hostname in the Subject Alternative Name (SAN). You can find this hostname on the Overview page of your project.\n\n### 3. Read Mutual TLS Certificates from Your Component\nComponents can read the mutual TLS certificates either from the file system or through environment variables. Ensure that you save the private key as a secret for security purposes. For detailed instructions on handling configurations and secrets, refer to the Choreo documentation on [Manage Configurations and Secrets](https://wso2.com/choreo/docs/devops-and-ci-cd/manage-configurations-and-secrets).\n\n### 4. Sample Implementation\nFor a practical example, you can refer to the sample project demonstrating mutual TLS communication between services. Check the repository at [service-to-service-mtls](https://github.com/wso2/choreo-samples/tree/main/docker-service-to-service-mtls).\n\n### Diagram of Mutual TLS Authentication\nTo visualize how mutual TLS works, the following diagram illustrates the authentication process:\n\n![Mutual TLS authentication](https://wso2.com/choreo/docs/assets/img/authentication-and-authorization/mutual-ssl-authentication.png)\n\n### Conclusion\nBy following these steps, you can establish secure communication between your components using mutual TLS in Choreo. For more detailed information, you can refer to the full documentation [here](https://wso2.com/choreo/docs/authentication-and-authorization/configure-mutual-tls-between-components/)."
How can I pass end-user attributes to upstream services?,"To pass end-user attributes to upstream services in Choreo, you can use a JSON Web Token (JWT) in the HTTP header of your API request. This JWT will carry user information, allowing your backend service to apply specific logic based on the user consuming the API.\n\n### Steps to Enable Passing End-User Attributes:\n\n1. **Select Your Component**: In the Choreo Console, go to the **Components Listing** pane and select the component for which you want to pass end-user attributes.\n\n2. **Access Deploy Settings**: Click on **Deploy** in the left navigation menu.\n\n3. **Configure Endpoint Settings**:\n   - Locate the **Set Up** card and click on **Endpoint Configurations**. This will open the **Endpoint Configurations** pane.\n   - If your component is an API Proxy, instead, go to the **Build Area** card and click **Security Settings**.\n\n4. **Enable Security Context**: \n   - Select the **Pass Security Context To Backend** checkbox.\n   - Optionally, you can specify audience values in the **End User Token Audiences** field, which restricts the JWT to intended recipients.\n\n5. **Apply Changes**: Click **Apply** to save your settings.\n\n6. **Redeploy the Component**: To apply the new settings, go back to the **Set Up** card and click **Deploy**.\n\n### How It Works:\nThe JWT created during this process will include claims, which are pieces of information about the user, application, or request. The JWT will be included in the outgoing API request as an `X-JWT-Assertion` header. Your backend service can then extract this JWT to retrieve the necessary information about the user.\n\n### Example of JWT Claims:\nClaims in the JWT may include attributes like:\n- `sub`: Subject identifier\n- `exp`: Token expiry time\n- `email`: User's email address\n- `http://wso2.org/claims/applicationname`: Application name used for the API invocation\n\nThese claims help the backend service to identify the user and perform necessary actions based on the attributes.\n\nFor additional details and examples, you can refer to the documentation [here](https://wso2.com/choreo/docs/authentication-and-authorization/pass-end-user-attributes-to-upstream-services/)."
How do I secure API access with Asgardeo?,"To secure API access using Asgardeo in Choreo, you need to follow a series of steps that involve both Choreo and Asgardeo. Here’s a structured approach to achieve this:\n\n### Steps to Secure API Access with Asgardeo\n\n1. **Assign Scopes to Your API in Choreo**:\n   - In the **Component Listing** pane, select the API you wish to secure.\n   - Navigate to **Manage** > **Permissions**.\n   - Click on **+ Add Permission (Scope)**.\n   - Enter the permission value in the **Permission List** and click **+ Add New**.\n   - Copy the fully qualified name of the added scope for future reference.\n   - Attach the scope to specific resources by selecting it from the **Select Permissions** list.\n   - Save and deploy your API.\n   - Finally, publish your API to the Choreo Developer Portal via **Manage** > **Lifecycle** > **Publish**.\n\n   For more details, refer to the [Assign Scopes to an API in Choreo documentation](https://wso2.com/choreo/docs/authentication-and-authorization/secure-api-access-with-asgardeo/#step-1-assign-scopes-to-an-api-in-choreo).\n\n2. **Create an API and an Application in Asgardeo**:\n   - Follow the [Asgardeo API Authorization guide](https://wso2.com/asgardeo/docs/guides/api-authorization/) to create an application and an API in Asgardeo.\n   - Important settings to configure:\n     - Set the **Access Token** type to `JWT`.\n     - Choose the appropriate grant types.\n     - Keep the client ID and client secret handy for later use.\n\n   For more information, you can consult the documentation on creating an API and application in Asgardeo [here](https://wso2.com/choreo/docs/authentication-and-authorization/secure-api-access-with-asgardeo/#step-2-create-an-api-and-an-application-in-asgardeo).\n\n3. **Create an Application in Choreo and Enable External IdP Authentication**:\n   - In the Choreo Developer Portal, navigate to **Applications** and click **+Create**.\n   - Provide a name and description for your application, then click **Create**.\n   - Under **Credentials**, choose **Production** and select **Asgardeo** as the Identity Provider.\n   - Enter the Client ID you copied from the previous step and click **+Add**.\n   - In the **Subscriptions** section, add the API that you assigned scopes to.\n\n   Detailed instructions can be found in the [Create an Application in Choreo documentation](https://wso2.com/choreo/docs/authentication-and-authorization/secure-api-access-with-asgardeo/#step-3-create-an-application-in-choreo-and-enable-external-idp-authentication).\n\n4. **Invoke the API with Scopes**:\n   - In the Developer Portal, go to your application and under **Credentials**, navigate to **Production**.\n   - Copy the **Token Endpoint** URL.\n   - Obtain an access token by making a POST request to the token endpoint with the necessary parameters.\n   - Use the access token to invoke your API through the OpenAPI console by specifying the required scopes.\n\n   For more details, refer to the [Invoke the Choreo API with scopes documentation](https://wso2.com/choreo/docs/authentication-and-authorization/secure-api-access-with-asgardeo/#step-4-invoke-the-choreo-api-with-scopes).\n\n### Summary\nThese steps outline how to secure your API access by integrating Asgardeo into Choreo. By setting up scopes, creating the necessary applications, and configuring external identity providers, you ensure that only authorized users can access your API resources."
How do I configure mutual TLS between the Choreo Gateway and my backend?,"To configure mutual TLS between the Choreo Gateway and your backend service, follow these steps to ensure secure connectivity:\n\n### Step 1: Configure the Backend Certificate\n1. Ensure that the backend endpoint is protected with TLS.\n2. Extract the public certificate of the backend server in PEM format and save it with a `.pem` extension.\n3. In the Choreo Console, navigate to the **Component Listing** pane and select the API proxy you want to configure.\n4. Go to **Develop** > **Endpoints**.\n5. Click **Configure** next to the relevant endpoint.\n6. Click **Upload Endpoint Certificate** and select the certificate file you saved earlier. This certificate will be set as the default certificate for all environments.\n\n### Step 2: Configure Mutual TLS with the Backend Service\nYou have two options for this step:\n\n#### Option A: Generate a Key Pair through Choreo\n1. Ensure mutual SSL is enabled by toggling the **Mutual SSL** switch.\n2. Click **Add Client Certificate**.\n3. In the dialog, select **Generate new key pair** and specify a common name for identification.\n4. Optionally, configure advanced options and click **Generate**.\n5. After generating, view and download the certificate in PEM format, which you will need to add as a trusted certificate in your backend.\n\n#### Option B: Use Your Own Certificate Pair\n1. Ensure mutual SSL is enabled by toggling the **Mutual SSL** switch.\n2. Click **Add Client Certificate**.\n3. In the dialog, select **Use my own key pair**.\n4. Upload the private key and public certificate in PEM format, or paste their contents.\n5. Click **Add** to generate and list the certificate under **Existing Certificates**.\n6. Similar to the previous option, download the certificate in PEM format for your backend.\n\n### Step 3: Associate the Certificate with the API\n1. On the **Endpoints** page, go to the **Existing Certificates** section.\n2. Select the appropriate certificate and click **Save**.\n\n### Step 4: Deploy the API\n1. Click on **Deploy** in the left menu.\n2. In the **Build Area** card, click **Configure & Deploy**.\n3. Verify the endpoint URL and click **Save & Deploy**.\n\n### Additional Notes\n- If your API backend changes based on the environment, ensure to update the respective certificate for each environment accordingly.\n- You can refer to the sample for mutual TLS communication for further guidance: [service-to-service-mtls](https://github.com/wso2/choreo-samples/tree/main/docker-service-to-service-mtls).\n\nFor more details, you can check the documentation [here](https://wso2.com/choreo/docs/authentication-and-authorization/secure-communication-between-the-choreo-gateway-and-your-backend-with-mutual-tls/#configure-mutual-tls-to-establish-secure-connectivity)."
