question,answer
How do I manage Ballerina configurables in Choreo?,"To manage Ballerina configurables in Choreo, you can follow these steps during the deployment or promotion of your Ballerina application:\n\n1. **Access the Deploy Page**: Navigate to the **Deploy** page in the Choreo console.\n\n2. **Configure & Deploy**: In the **Set Up** card, click on **Configure & Deploy**.\n\n3. **Specify Configurable Variables**: In the **Configurations** pane, you will see fields for configurable variables. Here, you can input values for these variables, which are defined in your Ballerina project.\n\n   | **Field**     | **Description**                                           |\n   | ------------- | --------------------------------------------------------- |\n   | **apiKey**    | The API key needed for your service                      |\n   | **latitude**  | Latitude for location-based services                      |\n   | **longitude** | Longitude for location-based services                     |\n   | **email**     | Email address for notifications                           |\n\n4. **Mark as Secret**: If you want to protect any of these variables (for example, the **apiKey**), you can mark it as a secret by clicking the lock icon next to the variable. This conceals the input value. If you need to update this secret later, you can click **Update Secret Content** to provide a new value.\n\n5. **Deploy**: After configuring the necessary values, click on **Deploy** to finalize the deployment of your application with the specified configurables.\n\nThese steps allow you to effectively manage Ballerina configurables within the Choreo console. For additional details, you can refer to the following documentation link: [Manage Ballerina Configurables](https://wso2.com/choreo/docs/devops-and-ci-cd/manage-configurations-and-secrets/#manage-ballerina-configurables)."
Can I customize the look and feel of the Choreo Developer Portal?,"Yes, users can customize the look and feel of the Choreo Developer Portal by changing the theme to match their brand. This customization enhances the developer experience for users consuming APIs. Here's how you can do it:\n\n### Steps to Customize the Developer Portal Theme\n\n1. **Admin Access**: Ensure that you are an admin user of your organization as only admin users can customize the Developer Portal theme.\n\n2. **Navigate to Settings**:\n   - In the Choreo Console, click on **Settings** in the left pane.\n\n3. **Access Organization Settings**:\n   - Click on the **Organization** list in the header to open the organization level settings page.\n\n4. **Select Devportal Theme**:\n   - Go to the **API Management** tab and click on **Devportal Theme**.\n\n5. **Customize Theme Elements**:\n   - You can customize various elements such as:\n     - **Home Page Title**: Expand the **Home Page** section and change the title in the **Title** field.\n     - **Color Theme**: Expand the **Color Palette** section and modify colors as required (e.g., background color, button colors).\n\n6. **Preview Changes**:\n   - Click **Preview** to see how the Developer Portal will look with the changes you made.\n\n7. **Save and Go Live**:\n   - After previewing, click **Save** to save your changes as a draft theme.\n   - To apply the changes, toggle the **Go Live** switch, and confirm by clicking **Enable**.\n\n8. **View in Developer Portal**:\n   - Finally, sign in to the Choreo Developer Portal at [https://devportal.choreo.dev](https://devportal.choreo.dev) to see the updated appearance.\n\n### Resetting the Theme\nIf you wish to reset the Developer Portal theme to the default, you can follow these steps:\n1. Go to the **Devportal Theme** settings.\n2. Click on **Reset to Default**.\n\n### Important Notes\n- Changes made to the theme cannot be undone, but you can always reset it to the default theme.\n- Customizing the theme provides a way to align the Developer Portal with your organization's branding.\n\nFor more detailed information, you can refer to the documentation [here](https://wso2.com/choreo/docs/administer/customize-the-developer-portal/)."
How do I add a custom domain to my Developer Portal?,"To add a custom domain to the Developer Portal in Choreo, you need to follow these steps:\n\n### Prerequisites\n- Ensure you have organization administrator privileges.\n- Create an organization in Choreo, if not already done.\n\n### Steps to Add a Custom Domain\n1. **Access the Organization Settings**:\n   - In the Choreo Console, go to the **Organization** list in the header.\n   - Click on **Settings** in the left navigation menu to open the organization-level settings page.\n\n2. **Navigate to URL Settings**:\n   - Click on the **URL Settings** tab.\n   - Then select the **Active Domains** tab.\n\n3. **Add a Custom Domain**:\n   - Click on **+ Add Domains**.\n   - In the **Add a Custom Domain** pane, you will need to enter your domain name and select the entity type. For the Developer Portal, the entity type will be **Developer Portal**. Note that the environment is not applicable in this case.\n\n4. **Create a DNS Record**:\n   - After entering your domain name, a CNAME target value will be generated. You need to create a DNS record with your DNS provider that associates your domain name to this CNAME target value.\n\n5. **Verify the CNAME Mapping**:\n   - Once the DNS record is created, return to the Choreo Console and click **Verify**. If the CNAME mapping is correct, the verification will complete successfully.\n\n6. **TLS Certificate Configuration**:\n   - After verification, click **Next**.\n   - Choose a TLS certificate provider. You can either import your own TLS certificates or click **Let's Encrypt** to allow Choreo to generate and manage the certificates for you.\n\n7. **Finalizing the Custom Domain**:\n   - Once you have selected or imported your TLS certificates, click **Add** to save the custom domain.\n\nAfter completing these steps, your custom domain will be available for the Developer Portal. You can access your organization's Developer Portal via the added domain immediately.\n\nFor detailed instructions, you can refer to the documentation [here](https://wso2.com/choreo/docs/administer/configure-a-custom-domain-for-your-organization/#configure-a-custom-domain-for-an-organization)."
How can I configure a private data plane in Choreo?,"To configure a private data plane (PDP) in Choreo, you'll need to follow several steps that involve setting up the necessary infrastructure and components. Below is a comprehensive guide on how to achieve this:\n\n### Prerequisites\n1. **Infrastructure Setup**:\n   - Ensure you have an upstream-compatible Kubernetes cluster.\n   - Set up a container registry and a key vault (secret store).\n   - Implement a logging service or log storage.\n\n2. **Cloud Providers**: \n   - Choreo private data planes can be deployed on major cloud providers such as Azure, AWS, and GCP, as well as on-premises infrastructure.\n\n### Steps for Configuration\n\n1. **Helm Installation**:\n   - You will need to execute a Helm installation on your Kubernetes infrastructure. During this installation, the following software components will be installed:\n     - Cilium CNI and service mesh.\n     - Choreo API Gateways and related components.\n     - Choreo PDP agent.\n     - Observability and logging APIs, along with observability agents.\n     - Flux controller for automatic updates.\n\n2. **Connectivity with the Control Plane**:\n   - The private data plane must communicate with the Choreo control plane. This communication is outbound from the private data plane. Ensure that your network allows outbound traffic to the public IP range of the Choreo control plane if outbound traffic is restricted.\n\n3. **Security Configuration**:\n   - Implement a firewall to protect incoming traffic and ensure all traffic undergoes authentication and authorization via the API Gateway.\n   - Use end-to-end encryption for network traffic through Cilium transparent encryption.\n\n### Management Models\nChoreo supports various management models for private data planes:\n- **WSO2 Fully Managed**: Infrastructure and PDP managed by WSO2 (available on Azure, AWS, and GCP).\n- **Customer Self-Managed**: WSO2 provides an installation script and updates, while the customer manages the infrastructure.\n\nEach model has specific responsibilities in terms of setup and management, which can be explored further based on your needs.\n\n### Observability and Compliance\n- Ensure that logs and observability data are stored within the data plane for enhanced security and compliance with regulatory standards.\n\n### Additional Notes\n- For security levels and management model details, refer to the [Private Data Plane Management Models](https://wso2.com/choreo/docs/references/private-data-plane-management-models/) documentation.\n\n### Visual Overview\nAdditionally, you can refer to the architecture diagrams for a clearer understanding of the private data plane's structure and observability features:\n- ![Private Data Plane Architecture](https://wso2.com/choreo/docs/assets/img/choreo-concepts/private-data-plane-architecture.png)\n- ![Observability Architecture](https://wso2.com/choreo/docs/assets/img/choreo-concepts/observability-architecture.png)\n\nFor further information, you can read more about private data planes in the [Choreo documentation](https://wso2.com/choreo/docs/choreo-concepts/data-planes/#private-data-planes)."
What are the requirements for an Azure AKS cluster used for a private data plane in Choreo?,"To use an Azure AKS cluster as a private data plane in Choreo, there are several key requirements you must meet:\n\n1. **Minimum Workload Nodes**: It is recommended to have a minimum of two (2) workload nodes in your AKS cluster to ensure high availability. Utilizing at least three workload nodes is advisable for 99.99% high availability and reliable failover during node failures or upgrades.\n\n2. **Kubernetes Cluster**: The AKS cluster must be upstream-compatible with Kubernetes, as it serves as the foundation for the private data plane.\n\n3. **Container Registry**: You need a container registry for storing and managing your container images.\n\n4. **Key Vault**: A key vault or secret store is required to manage sensitive information securely.\n\n5. **Logging Service**: An observability and logging service should be in place for monitoring and logging activities within the private data plane.\n\n6. **Helm Installation**: The setup of the Choreo private data plane involves using a Helm installation on the Kubernetes infrastructure. During this installation, several software components will be deployed, including Cilium CNI, Choreo API Gateways, and observability APIs.\n\n7. **Outbound Connectivity**: The private data plane requires outbound communication with the Choreo control plane for managing various activities. Ensure that your network allows outbound traffic to the public IP range of the Choreo control plane.\n\nFor a more detailed understanding of these requirements, you can refer to the relevant documentation [here](https://wso2.com/choreo/docs/choreo-concepts/data-planes/#private-data-planes)."
How do I set up role-based access control for enterprise login in Choreo?,"To set up role-based access control (RBAC) for enterprise login in Choreo, you'll need to follow a series of steps to ensure proper configuration. Here’s a comprehensive guide:\n\n### Prerequisites\nBefore you begin, make sure you have:\n1. Configured enterprise login for your organization.\n2. Ensured that your enterprise identity provider (IdP) includes group/role attributes in the tokens sent to Asgardeo.\n3. Administrator privileges in Choreo.\n\n### Step 1: Configure Asgardeo\n1. Sign in to [Asgardeo](https://asgardeo.io/).\n2. Configure your IdP as an external IdP in Asgardeo, selecting either OpenID Connect or SAML as the protocol.\n   - For OpenID Connect, configure the requested scopes to retrieve relevant group/role details.\n3. Follow these steps in the Asgardeo Console:\n   - Click on **Applications** and select the application named **WSO2_LOGIN_FOR_CHOREO_CONSOLE**.\n   - Go to the **Sign-in Method** tab and configure the IdP based on the selected protocol:\n     - For OpenID Connect, follow [Enable the OIDC IdP for login](https://wso2.com/asgardeo/docs/guides/authentication/enterprise-login/add-oidc-idp-login/#enable-the-oidc-idp-for-login).\n     - For SAML, follow [Enable the SAML IdP for login](https://wso2.com/asgardeo/docs/guides/authentication/enterprise-login/add-saml-idp-login/#enable-the-saml-idp-for-login).\n   - Go to the **User Attributes** tab, select the **Groups** attribute, check **Requested**, and click **Update**.\n4. Add user attributes as OpenID Connect scopes:\n   - Click on **Scopes**, edit **OpenID**, add the **Groups** attribute, and save changes.\n\n### Step 2: Map Choreo Groups to Enterprise IdP Groups via the Choreo Console\n1. In the Choreo Console, go to the top navigation menu and click **Organization**.\n2. Click on **Settings** in the left navigation menu, then go to the **Access Control** tab.\n3. Click **Groups** and select **Manage IdP Group Mapping**.\n   - Click the edit icon next to the Choreo group you want to map.\n   - Enter the exact IdP group name and click **Save**.\n\n### Important Note\nAny changes made to the IdP group mapping will take effect from the next login session.\n\nBy following these steps, you will successfully configure role-based access control for enterprise login in Choreo. This setup allows users from the external IdP to have the appropriate permissions based on their roles.\n\nFor more detailed information, you can refer to the official documentation [here](https://wso2.com/choreo/docs/administer/configure-enterprise-login/#configure-role-based-access-control-for-enterprise-login)."
What are the prerequisites for configuring self-sign-up in the Developer Portal?,"To configure self-sign-up in the Developer Portal of Choreo, there are a couple of prerequisites that you need to fulfill:\n\n1. **Sign in to the Choreo Console**: You must have access to the Choreo Console using your Google, GitHub, or Microsoft account.\n\n2. **Create an Organization**: If you are a new user, you need to create an organization with a unique name. For example, you can use a name like ""Stark Industries"".\n\nThese prerequisites ensure that you have the necessary access and organizational structure in place before you can proceed with the configuration of self-sign-up.\n\nFor further details on configuring self-sign-up, you can refer to the documentation here: [Configure Self-Sign-Up](https://wso2.com/choreo/docs/administer/configure-self-sign-up/#prerequisites)."
How can I control egress traffic for my organization?,"In Choreo, you can control egress traffic for your organization by configuring egress policies at both the organization and project levels. Here’s how to do it:\n\n### Organization-Level Egress Control\n\nTo set up an egress policy at the organizational level:\n\n1. **Select Your Organization**: In the Choreo Console header, go to the **Organization** list and select your organization.\n2. **Access Settings**: Click on **Settings** in the left navigation menu to open the organization-level settings page.\n3. **Egress Control Tab**: Click on the **Egress Control** tab.\n4. **Create Egress Policy**: Click **+ Create** to add a new egress policy.\n5. **Choose Egress Control Type**: Select the type of egress control:\n   - **Allow All**: This setting allows all egress traffic by default, but you can block traffic to specified IP ranges.\n   - **Deny All**: This blocks all egress traffic by default, with the option to allow traffic to specific IP ranges or domains.\n\n   **Important Notes**:\n   - After creating a rule, you cannot change the egress control type without deleting existing rules.\n   - Ensure that your rules do not inadvertently block necessary traffic for your applications.\n   - Policies apply across all environments in your organization and do not affect API proxies.\n\n![Configure an organization-level egress policy](https://wso2.com/choreo/docs/assets/img/administer/configure-an-organization-level-egress-policy.png)\n\n### Project-Level Egress Control\n\nTo override the organization-level egress policy at the project level:\n\n1. **Select Your Project**: In the Choreo Console header, go to the **Project** list and select your project.\n2. **Access Settings**: Click on **Settings** in the left navigation menu to open the project-level settings page.\n3. **Egress Control Tab**: Click on the **Egress Control** tab, where you will see that the organization-level policy is enforced by default.\n4. **Add Project-Level Rules**: You can add specific rules to restrict egress traffic further:\n   - If the organization level is set to **Allow All**, you can add project-level deny rules.\n   - If it is set to **Deny All**, you can remove inherited allow rules.\n\n![Add project-level rules](https://wso2.com/choreo/docs/assets/img/administer/add-project-level-rules.png)\n\nBy following these steps, you can effectively manage egress traffic for your organization in Choreo.\n\nFor more detailed information, you can refer to the official documentation here: [Control Egress Traffic for Your Organization](https://wso2.com/choreo/docs/administer/control-egress-traffic-for-your-organization/)."
How do I create an organization-level subscription plan?,"To create an organization-level subscription plan in Choreo, follow these steps:\n\n1. In the Choreo Console header, go to the **Organization** list and select your organization.\n2. In the left navigation menu, click **Settings**. This opens the organization-level settings page.\n3. Click the **API Management** tab and then click **Subscription Plans**.\n4. Click **+ Add Subscription Plan**.\n5. In the **Create Subscription Plan** pane, enter the appropriate values for each field:\n   - **Name**: Specify a unique name for the subscription plan. Note that this name is editable only during the creation process.\n   - **Stop on Quota Reach**: This checkbox is selected by default. When selected, requests will return an HTTP 429 response if the request count exceeds the limit.\n   - **Burst Control**: This option helps manage sudden request spikes. Select this checkbox if the **Request Count Time Unit** is set to **Hour** or **Day**.\n   - **Approval Required**: If selected, subscription requests for this plan will require administrator or API publisher approval to activate.\n   \n   ![Create subscription plan](https://wso2.com/choreo/docs/assets/img/administer/create-subscription-plan.png)\n\n6. Click **Create**. This will create the subscription plan and list it under **Subscription Plans**.\n\nAfter creating subscription plans, users with the API publisher role can assign these plans to APIs, allowing API consumers to select the appropriate plan during the subscription process.\n\nFor more detailed information, you can refer to the documentation: [Create API Subscription Plans](https://wso2.com/choreo/docs/administer/create-api-subscription-plans/)."
How can I customize the Developer Portal theme?,"To customize the theme of the Developer Portal in Choreo, follow these steps:\n\n1. **Admin Privileges**: Ensure you are an admin user of your organization, as theme customization requires these privileges.\n\n2. **Access Settings**:\n   - In the Choreo Console, click on **Settings** from the left pane.\n   - Click on the **Organization** list in the header to open the organization-level settings page.\n\n3. **Navigate to Devportal Theme**:\n   - In the **API Management** tab, select **Devportal Theme**.\n\n4. **Customize the Theme**:\n   - You can customize various aspects of the Developer Portal, such as:\n     - **Home Page**: Change the title by expanding the **Home Page** section and editing the **Title** field.\n     - **Color Theme**: Expand the **Color Palette** section to modify the colors. For example, you may want to change the background color and the primary color for buttons.\n\n5. **Preview Changes**: Click **Preview** to see how the Developer Portal will look with your changes.\n\n6. **Save Changes**:\n   - After making the desired changes, click **Save** to save them as a draft theme.\n   - To apply the changes, toggle the **Go Live** switch. Confirm by clicking **Enable** in the prompt that appears.\n\n7. **View Changes**: Sign in to the Choreo Developer Portal to see your changes reflected on the Home page.\n\n### Important Notes:\n- Any changes made cannot be undone. However, you can reset to the default theme if necessary.\n- For further details, you can refer to the documentation on [Customizing the Developer Portal](https://wso2.com/choreo/docs/administer/customize-the-developer-portal/)."
How do I manage members of an organization?,"To manage members of an organization in Choreo, including adding, removing, or modifying member roles, you can follow these guidelines:\n\n### Adding Members\n1. **Navigate to Organization Settings**: In the Choreo Console, go to the **Organization** section.\n2. **Invite Members**: Use the invite feature to add new members to your organization. You will need to enter the email addresses of the users you wish to invite.\n3. **Assign Roles**: When inviting members, be sure to assign them roles that define their permissions within the organization. You can choose from predefined roles such as Admin, API Publisher, API Subscriber, etc.\n\n### Removing Members\n1. **Access the Members List**: Navigate to the list of members in your organization.\n2. **Select Member to Remove**: Identify the member you wish to remove from the organization.\n3. **Remove Member**: Use the appropriate option to remove the member from the organization.\n\n### Modifying Member Roles\n1. **Access Member Details**: In the members list, find the member whose role you wish to modify.\n2. **Edit Role**: Click on the option to edit the member's role.\n3. **Assign New Role**: Choose a new role for the member from the available options and save your changes.\n\n### Managing User Permissions\nChoreo manages user permissions through groups and roles. Users can be organized into groups that inherit permissions based on their assigned roles. When creating or managing groups, ensure that you assign the corresponding roles to facilitate proper access control.\n\nFor a detailed explanation on managing members and roles in your organization, you can refer to the following documentation: [Manage Members of an Organization](https://wso2.com/choreo/docs/administer/manage-members-of-an-organization/)."
How do I configure Azure Active Directory as an external Identity Provider?,"To configure Azure Active Directory (Azure AD) as an external Identity Provider (IdP) in Choreo, follow these steps:\n\n### Prerequisites\nBefore you begin, ensure you have the following:\n- An Azure Active Directory account. If you don't have one, you can set it up [here](https://azure.microsoft.com/en-gb/).\n- Administrator rights to your Choreo organization, which are necessary for configuring the Azure AD account.\n\n### Steps to Configure Azure AD as an External IdP\n1. **Access Settings**: In the Choreo Console, click on **Settings** in the left navigation menu.\n2. **Navigate to Organization Settings**: Click on the **Organization** list in the header to open the organization level settings page.\n3. **Identity Providers Section**: Go to the **Application Security** tab, click on **Identity Providers**, and then click **+ Identity Provider**.\n4. **Select Azure AD**: Choose **Microsoft Entra ID (Azure AD)** as the Identity Provider.\n5. **Enter IdP Details**: Provide a name and description for the IdP.\n6. **Obtain Well-Known URL**: To get the `Well-Known URL` of your Azure AD instance, go to your Azure account, under **Azure Active Directory**, navigate to **App registrations**, and then **Endpoints**. Copy the URI under `OpenID Connect metadata document`. \n   - Note: If you are using the v1 access token, omit the v2.0 path segment from the URL. For example, convert `https://login.microsoftonline.com/<tenant-id>/v2.0/.well-known/openid-configuration` to `https://login.microsoftonline.com/<tenant-id>/.well-known/openid-configuration`.\n7. **Environment Settings**: Leave the **Apply to all environments** checkbox selected, or select specific environments if you want to restrict the IdP usage.\n8. **Review and Proceed**: Review the endpoints and click **Next** to complete the configuration.\n\nThese steps will help you successfully configure Azure AD as an external identity provider in your Choreo environment.\n\nFor more detailed instructions, you can refer to the full documentation [here](https://wso2.com/choreo/docs/administer/configure-an-external-idp/configure-azure-ad-as-an-external-idp/)."
