question,answer
How do I secure web applications with managed authentication?,"To secure your web applications with managed authentication using Choreo, you can follow these key steps:\n\n### 1. Set Up Managed Authentication\nChoreo's managed authentication simplifies the integration of authentication and authorization into your single-page web applications. It follows the backend for frontend (BFF) architecture, ensuring that OAuth tokens remain secure.\n\n#### Step 1.1: Implement the Sign-In Functionality\nYou need to implement a sign-in button that redirects users to the `/auth/login` path when clicked. Here is an example code snippet:\n\n```javascript\n<button onClick={() => { window.location.href = ""/auth/login""; }}>Login</button>\n```\n\nThis code will redirect users for authentication through the configured identity provider. Upon successful sign-in, Choreo will set session cookies and redirect the user to the specified post-sign-in path.\n\n#### Step 1.2: Obtain User Information Claims\nAfter sign-in, you can retrieve user information from the `userinfo` cookie or the `/auth/userinfo` endpoint. \n\nExample to get user info from the cookie:\n```javascript\nimport Cookies from 'js-cookie';\n\nconst encodedUserInfo = Cookies.get('userinfo');\nconst userInfo = JSON.parse(atob(encodedUserInfo));\nCookies.remove('userinfo', { path: <post-login-path> });\n```\n\n#### Step 1.3: Implement Sign-Out Functionality\nFor sign-out, implement a sign-out button that redirects to the `/auth/logout` path:\n\n```javascript\n<button onClick={() => { window.location.href = `/auth/logout?session_hint=${Cookies.get('session_hint')}`; }}>Logout</button>\n```\n\n### 2. Enable Managed Authentication\nTo ensure your web application utilizes managed authentication, enable it during the deployment process:\n\n1. In the **Component Listing** pane of the Choreo Console, select your web application.\n2. Click on **Deploy** in the left navigation menu.\n3. In the **Set Up** card, ensure the **Managed Authentication with Choreo** toggle is enabled and set the necessary paths for login, logout, and error handling.\n\n### 3. Configure the Identity Provider\nYou can use Choreo's built-in identity provider or an external one that supports OIDC/OAuth2.0.\n\n- **For Choreo Built-in Identity Provider**:\n  - In the Choreo Console, go to your component.\n  - Click on **Settings** > **Authentication Keys** and select **Choreo Built-In Identity Provider**.\n  - Generate the secret key.\n\n- **For External Identity Provider (like Asgardeo)**:\n  - Create an OIDC/OAuth2.0 application in your identity provider.\n  - Link this application to your Choreo component by pasting the Client ID and Client Secret in the Authentication Keys settings.\n\n### 4. Invoke APIs\nYou can invoke APIs using the relative path `/choreo-apis/<api-suffix>`, and Choreo will automatically handle the access tokens if managed authentication is enabled.\n\n### 5. Handle Session Expiry\nTo manage session expiry, monitor the `401 Unauthorized` response to trigger a re-login:\n\n```javascript\nexport const performGet = async (url) => {\n  try {\n    return await fetch('/choreo-apis/<api-suffix>');\n  } catch (error) {\n    if (error instanceof HttpError && error.status === 401) {\n      window.location.href = ""/auth/login"";\n    } else {\n      throw error;\n    }\n  }\n};\n```\n\n### Additional Notes\n- Managed authentication is available for web applications created with **React**, **Angular**, or **Vue.js** buildpacks.\n- Ensure to use modern browsers that support the 'SAMESITE' cookie attribute to prevent CSRF attacks.\n\nFor more detailed information, you can refer to the documentation: [Secure Web Applications with Managed Authentication](https://wso2.com/choreo/docs/authentication-and-authorization/secure-web-applications-with-managed-authentication/)."
How do I test secure API access with Choreo's built-in security token service?,"To test secure API access using Choreo's built-in security token service, you need to follow a series of steps that involve configuring permissions, roles, and user groups. Here’s a structured approach to achieve this:\n\n### Prerequisites\nBefore you start testing, ensure you have the following set up:\n1. **Choreo Built-in Identity Provider**: Configure with users. For guidance, see [Configure a User Store with the Built-In Identity Provider](https://wso2.com/choreo/docs/administer/configure-a-user-store-with-built-in-idp).\n2. **API Deployment**: You should have an API deployed and published in Choreo. If you don’t have one, you can [develop a service](https://wso2.com/choreo/docs/develop-components/develop-services/develop-a-service) or an [API Proxy](https://wso2.com/choreo/docs/develop-components/develop-an-api-proxy).\n3. **Web Application for API Subscription**: If you don’t have an application, you need to [create a web application](https://wso2.com/choreo/docs/develop-components/develop-web-applications/build-and-deploy-a-single-page-web-application).\n4. **Administrator Rights**: Ensure you have administrator rights in your Choreo organization to manage roles and permissions.\n\n### Steps to Test Secure API Access\n\n#### Step 1: Assign Permissions to the API\n1. In the Choreo Console, select the project containing your API.\n2. Click on the API component from the **Component Listing** pane.\n3. Navigate to the **Deploy** tab.\n4. Go to the **Set Up** card and select **Endpoint Configurations**.\n5. In the **Permissions List** section, click **+ Add Permission(Scope)**.\n6. Enter a permission value and click **+ Add New**.\n7. Copy the fully qualified name of the added permission for future reference.\n8. Attach the permissions to the API resources by selecting them under **Select Permissions**.\n9. Click **Apply** and redeploy the component by navigating to **Configure & Deploy** and clicking **Deploy**.\n10. Publish your API via the **Manage** > **Lifecycle** > **Publish**.\n\nFor more details, refer to the [Assign Permissions to an API](https://wso2.com/choreo/docs/authentication-and-authorization/test-secure-api-access-with-choreo-built-in-security-token-service/#step-1-assign-permissions-to-an-api-in-choreo).\n\n#### Step 2: Create Roles and Assign Permissions\n1. Go to the **Settings** in the Choreo Console.\n2. Click on the **Application Security** tab.\n3. Click **+ Role** to create a new role.\n4. Provide a **Role Name** and **Role Description**.\n5. Select the permissions you want to associate with this role and click **Create**.\n\nFor additional information, refer to the [Create Roles and Assign Permissions](https://wso2.com/choreo/docs/authentication-and-authorization/test-secure-api-access-with-choreo-built-in-security-token-service/#step-2-create-roles-and-assign-permissions).\n\n#### Step 3: Assign Roles to User Groups\n1. Navigate to the **Organization** menu and select your organization.\n2. Click on the **Application Security** tab and then **Role Management**.\n3. Click **Map Groups** next to the role you want to assign.\n4. Specify the group name(s) and click **Save**.\n\nFor more specifics, check the [Assign Roles to User Groups](https://wso2.com/choreo/docs/authentication-and-authorization/test-secure-api-access-with-choreo-built-in-security-token-service/#step-3-assign-roles-to-user-groups).\n\n### Conclusion\nAfter completing these steps, you will have configured your API with secure access settings. You can now proceed to test the API invocation, ensuring the appropriate permissions and roles are applied.\n\nFor a comprehensive guide, you can access the full documentation on [Testing Secure API Access with Choreo's Built-In Security Token Service](https://wso2.com/choreo/docs/authentication-and-authorization/test-secure-api-access-with-choreo-built-in-security-token-service/)."
What are the key features of the Choreo CLI?,"The Choreo CLI (Command Line Interface) offers several key features that facilitate the development and management of cloud-native applications. Here are the main features of the Choreo CLI:\n\n1. **Component Creation**: The CLI supports the creation of various component types, including:\n   - Service\n   - Web Application\n   - Webhook\n   - Scheduled Task\n   - Manual Task\n\n2. **Build Configuration**: When creating components, users can define build configurations tailored to each component type. The configurations can include parameters such as `buildPackLangVersion` for programming languages and `dockerFilePath` for Docker components.\n\n3. **Help Command**: Users can easily access help for specific commands by using the `--help` flag, allowing for efficient command usage and troubleshooting.\n\n4. **Updates and Uninstallation**: The CLI can be updated using a simple command, and if necessary, it can be uninstalled by deleting the `.choreo` directory in the user's home directory.\n\n5. **Integration with Git**: Although not explicitly mentioned in the CLI context, Choreo's overall capabilities include seamless integration with Git-based platforms, enhancing the development workflow.\n\nThese features make the Choreo CLI a powerful tool for developers looking to manage and deploy components in a streamlined manner.\n\nFor more detailed information, you can refer to the following document: [Choreo CLI FAQ](https://wso2.com/choreo/docs/references/faq/#choreo-cli)."
How do I create a multi-repository project using the Choreo CLI?,"To create a multi-repository project using the Choreo CLI, you'll need to follow a series of steps to connect your Git repositories and manage your components effectively. Here’s how you can do that:\n\n1. **Understand Project Structure**: In Choreo, a project is a logical group of related components that represent a single cloud-native application. Each project can consist of one or more components, which can be located in different Git repositories. This architecture allows you to manage your components flexibly.\n\n2. **Connect Multiple Git Repositories**: You can connect your Git repositories (GitHub, Bitbucket, or GitLab) to Choreo. This enables you to automate tasks and optimize workflows across multiple systems. You can connect existing repositories or start with an empty repository and commit your source code later. \n\n3. **Add Credentials for Git Providers**:\n   - Go to the **Settings** in the Choreo Console.\n   - Click on the **Credentials** tab and then on **+Add Credentials**.\n   - Enter a **Credential Name**, select your Git provider, and input your **Personal Access Token**.\n   - Click **Save** to establish the connection.\n\n4. **Develop Components**: Once your repositories are connected, you can develop components from these repositories. You will be able to deploy and manage these components within a single project, even if they are sourced from multiple repositories.\n\n5. **Deploy Your Project**: When deploying, all components within your project will be deployed into a single namespace in the Kubernetes cluster. You can control the visibility of these components, whether they are exposed to the public internet, internally, or kept private.\n\nFor further details and visual representations, you can refer to the relevant documentation: [Develop Components With Git](https://wso2.com/choreo/docs/develop-components/develop-components-with-git/) and [Project in Choreo](https://wso2.com/choreo/docs/choreo-concepts/project/)."
How do I view build logs using the Choreo CLI?,"To view build logs using the Choreo CLI, you would typically follow these steps:\n\n1. **Access the Build Page**: In the Choreo Console, navigate to the Build page where your builds are listed.\n\n2. **Select the Build**: Identify and select the specific build for which you want to see the logs.\n\n3. **View Build Details**: Click on ""View Details"" corresponding to the selected build. This action will display the logs related to that particular build.\n\nChoreo auto-generates build pipelines that include steps such as building a container image from source code, running security scans, and pushing the image to a container registry. Each build logs these processes, allowing you to troubleshoot issues effectively.\n\nFor more information on accessing build logs and understanding the build process, you can refer to the documentation [here](https://wso2.com/choreo/docs/choreo-concepts/ci-cd/#build)."
How do I manage authentication with personal access tokens in Choreo CLI?,"To manage authentication using personal access tokens in Choreo CLI, follow these general steps:\n\n1. **Obtain a Personal Access Token (PAT)**: First, you need to obtain a personal access token from your GitLab self-managed server. This token will grant Choreo the necessary permissions to perform actions on your behalf within the repository. The required permissions include full read/write access to the API and the repository.\n\n2. **Use the PAT in Choreo CLI**: Once you have your PAT, you can use it to authenticate your requests in the Choreo CLI. When making API calls, include the PAT in the `Authorization` header as follows:\n   ```bash\n   curl -H ""Authorization: Bearer <YOUR_PERSONAL_ACCESS_TOKEN>"" -X GET ""https://your-api-endpoint""\n   ```\n\n3. **Manage Access Tokens**: You can manage access tokens by generating, refreshing, or revoking them as necessary. For example, if you need to revoke a token, keep in mind that JWT access tokens are self-validating, which makes revocation challenging. It is recommended to use short-lived tokens and refresh them regularly to enhance security.\n\nFor detailed steps on how to authorize a self-managed GitLab with Choreo, you can refer to the documentation here: [Authorize self-managed GitLab with Choreo](https://wso2.com/choreo/docs/develop-components/develop-components-with-git/#authorize-self-managed-gitlab-with-choreo).\n\nIf you need more information about managing access tokens, you can check the following link: [Manage Applications - Revoke access tokens](https://wso2.com/choreo/docs/consuming-services/manage-application/#revoke-access-tokens). \n\nThis approach will help you effectively manage authentication using personal access tokens in Choreo CLI."
How do I configure the Pull Latest Submodules toggle in Choreo?,"To configure the 'Pull Latest Submodules' toggle in Choreo, follow these steps:\n\n1. **Access the Component**: In the Choreo Console, locate the component for which you want to enable the submodule updates. Click on the component in the **Component Listing** pane.\n2. **Navigate to Build Configurations**: In the left navigation menu, select **Build**.\n3. **Edit Build Configurations**: On the **Build** page, click to edit **Build Configurations**.\n4. **Enable the Toggle**: Find the **Pull Latest Submodules** toggle and turn it on.\n\n### Important Note:\n- This feature is currently supported only for components where the buildpack is **WSO2 MI**.\n\nIf you run into issues with previously built commits not reflecting the latest changes, ensure to set the container image pull policy to **Always** in the DevOps settings.\n\nFor more detailed information, you can refer to the documentation [here](https://wso2.com/choreo/docs/develop-components/develop-components-with-git/#authorize-github-with-choreo)."
What are the key features of the Choreo Marketplace?,"The Choreo Marketplace is designed to promote the reuse and sharing of services deployed within Choreo. Here are the key features of the Choreo Marketplace:\n\n1. **Service Sharing**: The Marketplace allows you to share all services deployed in Choreo, facilitating collaboration and reuse across teams.\n\n2. **Browse and Search**: Users can easily browse available services and utilize a search function to find services based on various attributes including name, label, and content.\n\n3. **Discoverability**: The Marketplace includes a filtering capability, where services can be categorized based on type (Internal or Third-party) and network visibility (Public, Organization, or Project).\n\n4. **Detailed Service Information**: Each service in the Marketplace has a detailed view that provides:\n   - **Overview**: A summary provided by the service developer.\n   - **API Definition**: Information extracted from the `component.yaml` file.\n   - **How to Use**: Instructions for using the service, including connection creation.\n   - **Related Documents**: Additional documents uploaded by the service developer.\n\n5. **User-Friendly Interface**: The Marketplace provides an intuitive interface for exploring services, ensuring that users can easily find and utilize the services they need.\n\nFor more detailed information, you can refer to the [Choreo Marketplace documentation](https://wso2.com/choreo/docs/choreo-concepts/choreo-marketplace/)."
What kind of Service Types does Choreo support for registration of 3rd Party Services?,"Choreo supports the registration of several types of third-party services, which can be integrated into your projects. Here are the types of services that you can register in Choreo:\n\n1. **REST APIs**: These are web services that adhere to the REST architectural style, allowing you to interact with resources using standard HTTP methods.\n\n2. **GraphQL APIs**: This type allows clients to request only the data they need and provides a more flexible alternative to REST APIs.\n\n3. **Asynchronous APIs**: These services enable communication that does not require the client to wait for the server to respond, allowing for more efficient processing and resource use.\n\n4. **SOAP**: Simple Object Access Protocol (SOAP) is a messaging protocol that allows programs running on different operating systems to communicate with each other.\n\n5. **gRPC**: This is a modern open-source high-performance RPC (Remote Procedure Call) framework that can run in any environment and is designed for connecting services in a distributed system.\n\nWhen registering a third-party service, you can do so at either the organization level, making it accessible from any project within the organization, or at the project level, which restricts access to a specific project.\n\nFor more detailed information on registering third-party services in Choreo, you can refer to the documentation [here](https://wso2.com/choreo/docs/integrate-and-manage-external-services/integrate-and-manage-third-party-services/#register-a-third-party-service-in-choreo)."
How to integrate with a GenAI service?,"To integrate a Generative AI (GenAI) service using Choreo, you need to follow a series of steps to register the service, which will then be available for consumption in your projects. Here’s a comprehensive guide on how to do this:\n\n### Steps to Integrate a GenAI Service in Choreo\n\n#### 1. **Prerequisites**\n   Before starting the registration process, ensure you have the following details from your GenAI service provider:\n   - **API key**\n   - **Service URL**\n   - Any other necessary parameters, such as client credentials.\n\n#### 2. **Select a Service Provider**\n   - In the Choreo Console, choose whether to register the GenAI service at the **Organization level** (accessible to all projects) or the **Project level** (restricted to a specific project).\n   - Navigate to the left menu and click on **Dependencies**, then select **GenAI Services**.\n   - Click on **+ Register** to initiate the process.\n   - Select the appropriate service provider from the list.\n\n#### 3. **Provide Service Details**\n   - Enter the required details for the service:\n     - **Name**: Give your service a recognizable name.\n     - **Version**: Specify the version of the service.\n     - **Service URL**: Provide the URL for the GenAI service.\n   - Click **Next** to proceed.\n\n#### 4. **Add Configurations**\n   - Input the configuration details required for your selected service provider. Note that the configurations may vary based on the provider.\n   - Ensure that you include all mandatory configurations to successfully register the service.\n   - After filling in the details, click **Register**.\n\nOnce registered, your GenAI service will be listed in the **Internal Marketplace**, making it available for consumption through a Connection.\n\n### Additional Information\n- If you need to manage your registered GenAI services, you can view or update their details by again navigating to **Dependencies** > **GenAI Services** in the Choreo Console.\n- For more details on consuming a GenAI service via a connection, refer to the documentation on [Creating a Connection](https://wso2.com/choreo/docs/develop-components/sharing-and-reusing/create-a-connection).\n\nFor further information, you can refer to the comprehensive documentation on integrating and managing GenAI services [here](https://wso2.com/choreo/docs/integrate-and-manage-external-services/integrate-and-manage-gen-ai-services/#register-a-genai-service)."
What is the difference between Choreo data plane and private data plane?,"Choreo's architecture includes two types of data planes: the **Choreo data plane** (often referred to as the cloud data plane) and the **private data plane** (PDP). Here are the main differences between them:\n\n### Choreo Data Plane (Cloud Data Plane)\n- **Infrastructure**: Utilizes a multi-tenanted infrastructure model, meaning multiple customers share the same environment while ensuring security and isolation of user data.\n- **Deployment**: Applications are deployed on public cloud infrastructure managed by WSO2.\n- **Suitability**: Ideal for users who prefer a managed service without the need for dedicated infrastructure. It is suitable for organizations that do not have stringent data privacy requirements.\n\n### Private Data Plane (PDP)\n- **Infrastructure**: Offers dedicated infrastructure for a single organization, providing greater privacy and control over applications and data.\n- **Deployment**: Can be deployed across major cloud providers (like Azure, AWS, GCP) or on-premises. This allows organizations to meet specific compliance and security requirements.\n- **Requirements**: Requires an upstream-compatible Kubernetes cluster, a container registry, key vaults, and logging services.\n- **Management Models**: Supports various management models, including fully managed by WSO2 or self-managed by the customer, allowing flexibility based on organizational needs.\n\n### Summary\nIn essence, the Choreo data plane is a shared environment managed by WSO2, aimed at users looking for ease of deployment without dedicated resources. In contrast, the private data plane provides dedicated resources and greater control for organizations with specific security and compliance needs.\n\nFor more detailed information, you can refer to the following links:\n- [Choreo Data Planes](https://wso2.com/choreo/docs/choreo-concepts/data-planes/)\n- [Private Data Plane Overview](https://wso2.com/choreo/docs/choreo-concepts/data-planes/#private-data-planes)"
