question,answer
How do I configure a custom error page for managed authentication in Choreo?,"To set up a custom error page for managed authentication in Choreo, you need to define the error path in the configuration of your web application. When an error occurs during a redirection-based process, such as sign-in or sign-out, Choreo will automatically redirect users to your specified custom error page.\n\nHere are the steps to configure the custom error page:\n\n1. **Enable Managed Authentication**: Ensure that managed authentication is enabled for your web application component during the deployment process.\n\n2. **Configure Paths**: In the configuration settings, you will find a field labeled **Error Path**. This is where you can specify the relative path to your custom error page.\n\n3. **Default Behavior**: If you do not configure an error path, Choreo's managed authentication will redirect users to its default error page whenever an error occurs.\n\n4. **Error Page Parameters**: When redirecting to the custom error page, Choreo will include the following query parameters in the URL:\n   - **code**: A short textual error code indicating the error.\n   - **message**: A description of the error.\n\nBy defining a custom error page, you can ensure that users have a better experience when encountering issues during authentication.\n\nFor further details on this setup, you can refer to the documentation [here](https://wso2.com/choreo/docs/authentication-and-authorization/secure-web-applications-with-managed-authentication/#step-1-set-up-managed-authentication-for-your-web-application)."
What are the limitations of the free tier in Choreo concerning API management?,"The free tier of Choreo has specific limitations regarding API management. Here are the key constraints you should be aware of:\n\n| Resource                                                         | Limit                                    |\n|------------------------------------------------------------------|------------------------------------------|\n| Maximum request payload                                           | 50 MB                                    |\n| URL size                                                        | 2 KB                                     |\n| Request header                                                  | <ul><li>Total: 40 KB</li><li>Max Single: 10 KB</li></ul> |\n| Total request duration                                           | <ul><li>Minimum: 10 seconds</li><li>Default: 1 minute</li><li>Maximum: 5 minutes</li></ul> |\n| Maximum connection duration (WebSocket APIs)                    | 15 minutes                               |\n| Connection idle timeout (WebSocket APIs)                         | 5 minutes                                |\n| Size for API definition (OpenAPI document)                       | 10 MB                                    |\n| Number of APIs for PDP (Public Developer Portal)                 | 1000 API deployments                     |\n| Number of APIs per organization (free tier)                     | 5 APIs for free users                   |\n| Number of Developer Portal applications per organization (free tier) | 10 applications for free users          |\n\nThese limitations are important to consider when planning your API management activities on the free tier of Choreo. \n\nFor further details, you can refer to the documentation [here](https://wso2.com/choreo/docs/references/choreo-limitations/#api-management-limits)."
How can I use a personal access token with the Choreo CLI?,"To utilize a personal access token (PAT) with the Choreo CLI for authentication or other operations, follow these steps:\n\n1. **Generate a Personal Access Token**: First, you need to create a personal access token on the platform you are using (for example, GitLab or Bitbucket) where your repositories are hosted. This token will grant Choreo permission to perform actions on your behalf within the repository.\n\n2. **Authorize Choreo with Your PAT**:\n   - For **self-managed GitLab**: When you authorize Choreo using your PAT from GitLab, it grants permissions such as full read/write access to the API, covering all groups and projects, as well as read/write access to the repository.\n   - For **Bitbucket**: Authorizing with a Bitbucket PAT allows Choreo to perform actions such as listing branches, creating branches, creating pull requests, and triggering deployments.\n\n3. **Using the PAT in Choreo CLI**: When executing commands in the Choreo CLI, you can include the PAT in your requests to authenticate and perform operations as needed.\n\nIt's important to note that the specifics of how to include the PAT in CLI commands may vary, and it's essential to refer to the specific documentation or command reference for the CLI for detailed instructions.\n\nFor more detailed information on authorizing GitLab or Bitbucket with Choreo using a personal access token, you can refer to the following links:\n- [Authorize self-managed GitLab with Choreo](https://wso2.com/choreo/docs/develop-components/develop-components-with-git/#authorize-self-managed-gitlab-with-choreo)\n- [Authorize Bitbucket with Choreo](https://wso2.com/choreo/docs/develop-components/develop-components-with-git/#authorize-bitbucket-with-choreo)"
How do I rotate personal access tokens regularly for better security?,"To rotate personal access tokens regularly in Choreo for enhanced security, you can follow these best practices:\n\n1. **Use Short-Lived Tokens**: Set an expiry time for your access tokens to be no longer than 15 minutes (900 seconds). This minimizes the window of opportunity for unauthorized access if a token were to be compromised. By default, Choreo sets the token lifespan to 15 minutes, but you can configure this to be shorter based on your security needs.\n\n2. **Implement Refresh Tokens**: Use refresh tokens to obtain new access tokens once the current ones expire. Refresh tokens can be generated alongside access tokens and allow your application to request new access tokens without requiring user interaction. This is particularly useful in maintaining a secure and seamless user experience. Ensure that refresh tokens are treated with the same level of security as access tokens.\n\n3. **Revoke Tokens When Necessary**: If you suspect that a token has been compromised, you should revoke it immediately to prevent unauthorized access. Choreo provides the capability to revoke access tokens, which is crucial for maintaining security.\n\n4. **Use Secure Storage**: Store your tokens securely to prevent unauthorized access. This includes using secure encryption methods and ensuring that tokens are not exposed in logs or front-end code.\n\n5. **Regularly Monitor and Rotate Keys**: Regularly monitor the usage of your tokens and consider rotating your consumer keys and secrets periodically to enhance security.\n\nBy following these practices, you can rotate personal access tokens effectively and enhance the overall security of your applications in Choreo.\n\nFor more detailed information, you can refer to the documentation on [Revoking Access Tokens](https://wso2.com/choreo/docs/consuming-services/manage-application/#revoke-access-tokens) and [Grant Types](https://wso2.com/choreo/docs/consuming-services/manage-application/#grant-types)."
What are the different authentication types supported for container registries in Choreo?,"Choreo supports several authentication types for container registries, allowing you to connect securely based on your specific needs. Here are the different authentication types available:\n\n1. **Public (anonymous) access**:\n   - This option is for container registries that allow unrestricted public access. Only the registry host information is required.\n   - Example registry hosts:\n     | Vendor                           | Registry host                |\n     |----------------------------------|------------------------------|\n     | Docker Hub (public repositories) | `registry.hub.docker.com`    |\n     | Docker Hub (private repositories) | `registry.docker.com`        |\n\n2. **Basic authentication**:\n   - This method requires a username and password to authenticate to the container registry.\n\n3. **Docker config**:\n   - You can provide a Docker config in JSON format for authentication. Note that this option allows registration of only one container registry and requires the credentials to be included directly in the configuration.\n   - Sample Docker config format:\n     ```json\n     {\n       ""auths"": {\n         ""index.docker.io/v1/"": {\n           ""auth"": ""c3R...zE2""\n         }\n       }\n     }\n     ```\n\n4. **Vendor-specific authentication**:\n   - This is tailored for specific cloud providers and involves methods managed at the Kubernetes level. Choreo needs to know the registry host as the data plane will have implicit access.\n   - Options vary by vendor, including:\n     - **Azure Container Registry**: Service principal-based basic authentication.\n     - **Google Artifact Registry**: Service account-based basic authentication.\n     - **AWS ECR**: Vendor-specific authentication that doesn't require static passwords when integrated with EKS.\n     - **Docker Hub (Private)**: Basic authentication or Docker config.\n     - **GitHub Container Registry**: Basic authentication using a personal access token (PAT).\n\nThese authentication types enable you to connect your container registries securely based on the requirements of your deployment.\n\nFor more details on how to register a container registry with these authentication types, you can refer to the documentation [here](https://wso2.com/choreo/docs/develop-components/bring-your-own-image/#step-1-register-a-container-registry)."
How do I register a container registry with vendor-specific authentication on a private data plane?,"To register a container registry with vendor-specific authentication on a private data plane in Choreo, you need to follow these steps:\n\n1. **Access the Organization Settings**:\n   - In the Choreo Console, navigate to the **Organization** list in the header and select your organization.\n\n2. **Navigate to Container Registries**:\n   - Click on **Settings** in the left navigation menu to open the organization settings page.\n   - Switch to the **Credentials** tab and then click on the **Container Registries** tab.\n\n3. **Add a New Registry**:\n   - Click on **+Add Registry** to start configuring your container registry connection.\n\n4. **Specify Details**:\n   - Enter a **Registry Display Name** for easy identification.\n   - Select **Vendor-specific authentication** as the authentication type.\n\n5. **Provide Required Information**:\n   - Depending on your cloud provider and the specific container registry, you need to provide the registry host information. This is critical because the data plane will already have implicit access to the registry.\n   - Follow the specific guidelines for your cloud provider's registry:\n     - **Azure Container Registry (ACR)**: Contact Choreo support to enable infrastructure-level private access to your registry from the Azure private data plane on AKS.\n     - **Google Artifact Registry (GAR)**: Contact Choreo support to enable infrastructure-level private access to your registry from GCP private data plane on GKE.\n     - **AWS Elastic Container Registry (ECR)**: Contact Choreo support to enable a private connection between your ECR and the underlying EKS clusters on your data plane.\n\n6. **Save the Configuration**:\n   - After entering all necessary information, click **Save** to register your container registry.\n\nBy following these steps, you can successfully register a container registry with vendor-specific authentication for a private data plane in Choreo.\n\nFor more detailed instructions and guidance, you can refer to the following documentation: [Register a Container Registry](https://wso2.com/choreo/docs/develop-components/bring-your-own-image/#step-1-register-a-container-registry)."
Can I use a Dockerfile to deploy my web application?,"Yes, a Dockerfile can be used to deploy a web application in Choreo. Here are the steps and guidelines to follow:\n\n### Steps to Deploy a Web Application Using a Dockerfile in Choreo:\n\n1. **Connect to Your GitHub Repository**:\n   - Ensure that your GitHub repository contains the Dockerfile for your containerized web application.\n   - If you haven't done so, authorize Choreo to access your GitHub account and connect to the repository.\n\n2. **Create a Web Application Component**:\n   - In the Choreo Console, click on **+ Create** and select the **Service** card.\n   - Choose **Docker** as the buildpack.\n\n3. **Specify Your Dockerfile**:\n   - Provide the path to your Dockerfile in the repository. This allows you to have full control over the build process.\n   - Ensure that the Dockerfile includes a valid User ID (UID) defined under the USER instruction. It should be a numeric value between 10000-20000.\n\n4. **Set Component Details**:\n   - Enter a display name, a unique name, and a description for your service component.\n   - Ensure that the component name is unique and cannot be changed after creation.\n\n5. **Create the Component**:\n   - Click **Create** to finalize the creation of the component. This will take you to the Overview page of the component.\n\n6. **Build the Application**:\n   - In the left navigation menu, click on **Build**.\n   - In the **Builds** pane, select the latest commit and click **Build**. This triggers the build process and displays the progress in the **Build Logs** pane.\n   - Choreo performs a Dockerfile scan and a vulnerability scan on the resulting image.\n\n7. **Monitor Build Status**:\n   - Once the build is complete, you will see the build status in the **Builds** pane. If there are any critical vulnerabilities detected, the build will fail.\n\n8. **Deploy the Application**:\n   - After a successful build, you can proceed to deploy your web application as needed.\n\n### Important Notes:\n- Ensure your Dockerfile follows best practices, including specifying a non-root user for security reasons.\n- The build process may take some time, so monitor the logs for any issues during the build.\n\nFor detailed guidance, you can refer to the [Choreo documentation on developing a service with Docker](https://wso2.com/choreo/docs/develop-components/develop-services/develop-a-service-with-docker/) and the [Choreo documentation on building and deploying a single-page web application](https://wso2.com/choreo/docs/develop-components/develop-web-applications/build-and-deploy-a-single-page-web-application/#create-a-web-application)."
How do I configure health checks for a Tailscale proxy in Choreo?,"To configure health checks for a Tailscale proxy in Choreo, you can utilize one of the open ports of the TCP forwarder as a health endpoint. This setup ensures that the Tailscale proxy remains responsive and operational, which is crucial since it acts as a forward proxy.\n\nHere are the best practices for configuring health checks:\n\n1. **Select an Open Port**: Choose one of the open ports that the TCP forwarder is using to serve traffic. This port will be monitored to check the health of the service.\n2. **Set Up Health Probes**: Follow the specific steps to set up health probes in Choreo, which provide details on how to implement and configure these checks.\n\nFor more detailed instructions on setting up health checks in Choreo, you can refer to the documentation on [Set up health checks](https://wso2.com/choreo/docs/devops-and-ci-cd/configure-vpns-on-the-choreo-cloud-data-plane/#best-practices).\n\nAdditionally, it's recommended to disable the scale-to-zero feature for the Tailscale proxy to maintain consistent connections with the Tailscale VPN mesh, as this could lead to service downtime if enabled.\n\nFor further information and best practices regarding Tailscale proxy configuration, please refer to the relevant documentation [here](https://wso2.com/choreo/docs/devops-and-ci-cd/configure-vpns-on-the-choreo-cloud-data-plane/#best-practices)."
What is the difference between a ConfigMap and a Secret in Choreo?,"In Choreo, both ConfigMaps and Secrets are used to manage configurations and sensitive information for your components, but they serve different purposes and have distinct characteristics:\n\n### ConfigMap\n- **Visibility**: Configurations can be read and updated via the Choreo Console after creation, making them easier to manage during development and testing.\n- **Use Case**: ConfigMaps are suitable for storing non-sensitive configuration data that may need to be changed or viewed during the lifecycle of the application.\n\n### Secret\n- **Visibility**: Secrets are write-only. Once created, their content cannot be viewed or retrieved through the Choreo Console. However, you can overwrite the existing content at any time.\n- **Use Case**: Secrets are intended for storing sensitive data such as database passwords, cloud credentials, and service account information. It is recommended to use Secrets for any sensitive information to provide better security.\n\n### Summary\n- Use **Secrets** for sensitive data that should not be exposed or read directly (e.g., passwords, API keys).\n- Use **ConfigMaps** for configuration data that can be safely viewed and modified.\n\nThis distinction helps ensure that sensitive information is handled securely while allowing for flexibility in managing application configurations.\n\nFor more details, you can refer to the Choreo documentation on [Manage Configurations and Secrets](https://wso2.com/choreo/docs/devops-and-ci-cd/manage-configurations-and-secrets/#the-difference-between-configurations-and-secrets)."
How can I automatically deploy images to Choreo with an external CI/build pipeline?,"To integrate an external CI/build pipeline with Choreo for automatic image deployment, follow these steps:\n\n1. **Build and Push the Container Image**: Start by building and pushing the container image associated with your Choreo component to your container registry.\n\n2. **Access the DevOps Section**: In the Choreo console, navigate to the left menu and click on **DevOps**, then select **External CI**.\n\n3. **Generate a Token**: In the **Manage Tokens** section, generate a token for your CI pipeline. This token is specific to the component you are deploying, so ensure it's securely stored (for example, as a GitHub secret if using GitHub Actions).\n\n4. **Trigger Automatic Deployment**: To initiate an automatic deployment to your development environment when a new image is available, you will need to send an HTTP POST request to the Choreo webhook endpoint with the updated image details. You can also use the provided webhook snippets for this purpose.\n\n**Additional Notes**:\n- Choreo does not automatically detect new images or tags in the container registry; hence, you must manually trigger deployments via your CI pipeline.\n- This integration is particularly useful if you have a pre-existing CI setup or if you're looking to create a dedicated pipeline for image creation and deployment.\n\nFor more details, you can refer to the documentation here: [Auto-deploy images in Choreo with an external CI/build pipeline](https://wso2.com/choreo/docs/develop-components/bring-your-own-image/#auto-deploy-images-in-choreo-with-an-external-cibuild-pipeline)."
What is the maximum size allowed for a request payload in Choreo?,"In Choreo, the maximum size allowed for a request payload depends on the context in which you are operating:\n\n1. **For API Management**: The maximum request payload size is **50 MB**. This limit applies when working with APIs in Choreo.\n\n2. **For Web Applications**: The request size limit is **256 KB**, which includes headers, cookies, and payloads.\n\nThese limits are critical to ensure optimal performance and resource management within Choreo.\n\nFor more detailed information, you can refer to the following documentation:\n- [Choreo Limitations - API management limits](https://wso2.com/choreo/docs/references/choreo-limitations/#api-management-limits)\n- [Choreo Limitations - Choreo cloud data plane limits](https://wso2.com/choreo/docs/references/choreo-limitations/#choreo-cloud-data-plane-limits)"
How can I upgrade my Choreo service plan?,"To upgrade your Choreo service plan, you need to contact Choreo support directly via email at [choreo-support@wso2.com](mailto:choreo-support@wso2.com). The specific options available for service plan upgrades are not detailed in the documentation, but the support team will be able to provide you with the necessary information regarding your options.\n\n### Steps to Upgrade Your Service Plan:\n1. **Contact Choreo Support**: Send an email to Choreo support at the mentioned email address.\n2. **Provide Necessary Information**: Include details about your current service plan and any specific requirements or questions you have regarding the upgrade.\n\n### Additional Information:\n- Choreo bills platform services based on your existing subscription, and costs depend on the chosen service plan and usage of resources. \n- There may be different service plans available, but you'll need to consult with support for specifics.\n\nFor more details about billing and service plans, you can refer to the documentation [here](https://wso2.com/choreo/docs/references/choreo-platform-services-billing-and-upgrades/#upgrade-a-service-plan)."
What is the difference between internal and external APIs in Choreo?,"In Choreo, the differences between internal and external APIs primarily concern their usage, functionality, and access:\n\n### Internal APIs\n- **Usage**: Internal APIs are designed for use within an organization. They facilitate communication between different services and applications that are part of the same organizational structure.\n- **Functionality**: These APIs allow internal services to interact securely without exposing sensitive data or functionalities to the outside world.\n- **Access**: Access is restricted to users and applications within the organization. You can set the network visibility of an API endpoint to ""Organization,"" ensuring that only components within the same organization can access it.\n\n### External APIs\n- **Usage**: External APIs are intended for public use, allowing external consumers to interact with a service. They are exposed to the outside world and can be used by applications or users outside the organization.\n- **Functionality**: These APIs provide functionalities that can be consumed by third-party applications. They often include additional features such as API management, throttling, and analytics.\n- **Access**: Access is open to any client, regardless of their organization. When exposing an endpoint as an external API, you set the network visibility to ""Public."" This allows broader access while ensuring proper security measures, such as authentication and authorization, are in place.\n\n### API Management Features\nBoth internal and external APIs can leverage Choreo's API management features, which include:\n- Full lifecycle management of APIs\n- API throttling\n- Secure APIs with industry-standard authorization flows\n- API analytics and monitoring\n\nTo expose endpoints as managed APIs in Choreo, you must configure their network visibility appropriately, allowing them to be accessed either internally or externally.\n\nFor more detailed information, you can refer to the relevant documentation: \n- [Expose endpoints as managed APIs](https://wso2.com/choreo/docs/develop-components/configure-endpoints-body/#expose-endpoints-as-managed-apis)\n- [Configure endpoints in Choreo](https://wso2.com/choreo/docs/develop-components/configure-endpoints-body/)"
How can I add a description to my APIs?,"To add or update descriptions for APIs in Choreo, you can utilize the documentation feature provided in the Choreo Console. Here’s how you can do it:\n\n### Adding Documentation for an API\n1. In the **Component Listing** pane of the Choreo Console, click on the component (API) for which you want to add or update the description.\n2. In the left navigation menu, click **Manage** and then select **Documents**.\n3. You can add a new document by specifying a title and providing the content in markdown syntax. Make sure to include the necessary details such as a brief description of the API, how to invoke it, and any limitations or restrictions.\n4. Click **Add** to save the new document.\n\n### Updating Existing Documentation\n- If you want to update an existing document, you can simply edit the content of that document in the same **Documents** section and save your changes.\n\n### Purpose of Documentation\nAdding proper documentation helps API consumers understand your API better, including how to use it effectively and any specific constraints they should be aware of.\n\nFor further details, you can refer to the documentation on adding documents to an API: [Add documents to an API](https://wso2.com/choreo/docs/api-management/documents/#add-documents-to-an-api)."
What are the supported source control software in Choreo?,"Choreo supports the following source control software for version control and integrations:\n\n1. **GitHub**\n2. **Bitbucket** (both Bitbucket Server and Bitbucket Cloud)\n3. **GitLab**\n\nYou can connect an existing repository from any of these platforms or start with an empty repository and commit your source code later. This integration allows you to automate tasks and optimize workflows within the Choreo platform.\n\nFor more detailed information on connecting a Git repository to Choreo, you can refer to the documentation [here](https://wso2.com/choreo/docs/develop-components/develop-components-with-git/)."
