question,answer
How do I monitor the disk usage of my Choreo-managed database?,"To monitor the disk usage of a Choreo-managed database, you can utilize the Observability dashboard available in the Choreo console. This dashboard provides a comprehensive interface to visualize and monitor the performance of your deployed services, including metrics related to databases.\n\nHere are the steps to monitor the disk usage:\n\n1. **Access the Observability Dashboard**: In the left navigation menu of the Choreo console, click on **Observability**.\n\n2. **Monitor Key Metrics**: The Observability dashboard allows you to observe various metrics, including:\n   - **Throughput**: The number of requests served over a given period.\n   - **Latencies**: The response times associated with those requests.\n   - **Logs**: View logs generated over a specific timeframe, which can help identify any issues related to disk usage.\n\n3. **Diagnostic View**: Use the diagnostics view to analyze any anomalies or performance issues. This can include examining logs and throughput data that may indicate disk usage concerns.\n\nFor further details about the observability features, you can refer to the [Observability Overview](https://wso2.com/choreo/docs/monitoring-and-insights/observability-overview/) documentation.\n\nUnfortunately, the specific steps to monitor disk usage directly are not detailed in the provided documentation, so if you require more specific information or functionality, I recommend checking within the observability tools in the Choreo console or contacting support for assistance."
What are the steps to back up and restore a Choreo-managed MySQL database?,"Choreo provides automatic backups for MySQL databases based on different service plans. The backup and restore capabilities depend on the chosen service plan. Here’s a summary of how backups work for Choreo-managed MySQL databases:\n\n### Backup Mechanism\n- **Automatic Backups**: Choreo runs full backups daily for MySQL databases and records binary logs continuously.\n- **Backup Retention Time**: The duration for which backups are retained varies by service plan:\n  - **Hobbyist Plan**: No backup retention.\n  - **Startup Plan**: Backups retained for 2 days.\n  - **Business Plan**: Backups retained for 14 days.\n  - **Premium Plan**: Backups retained for 30 days.\n  \n### High Availability\n- The availability of backups is also linked to the high availability configurations of your service plan, with higher plans providing better redundancy and quicker restore options in case of failures. \n\n### Restoring a Database\nWhile the documentation does not provide specific steps for manually restoring a MySQL database, it indicates that Choreo automatically handles outages and failures by replacing broken nodes with new ones, which resume from the last known good state based on the backups.\n\nFor detailed information regarding the backup and restore process and the specifics of your plan, you can refer to the following documentation: [Choreo-managed MySQL Databases](https://wso2.com/choreo/docs/manage-databases-and-caches/choreo-managed-mysql-databases/#high-availability-and-automatic-backups). \n\nIf you have more specific requirements or a different context concerning your database backup and restore needs, please let me know!"
How can I configure a custom health check endpoint for my web application?,"To configure a custom health check endpoint for your web application in Choreo, you can set up liveness and readiness probes. Here are the steps to do so:\n\n### Steps to Configure Health Checks\n\n1. **Select Your Component**:\n   - In the Choreo Console, navigate to the **Component Listing** pane and click on the component (your web application) for which you want to configure health checks.\n\n2. **Access Health Checks**:\n   - In the left navigation menu, click on **DevOps**, then select **Health Checks**.\n\n3. **Create Health Checks**:\n   - On the **Health Checks** page, click **+ Create** to set up your probes.\n\n4. **Configure Liveness Probe**:\n   - Set up the liveness probe, which can be an HTTP `GET` request to your custom health check endpoint (e.g., `/healthz` or `/health`). You may also configure additional HTTP headers if necessary.\n   - Click **Save** after configuring.\n\n5. **Configure Readiness Probe**:\n   - Similarly, configure the readiness probe based on your requirements.\n   - Click **Save** again.\n\n### Important Notes\n- Liveness probes are used to determine if your application is running; if it fails, the container will restart.\n- Readiness probes check if your application is ready to handle traffic. If it fails, the container will stop receiving requests but won’t restart.\n- You can update or remove these probes at any time.\n\n### Additional Considerations\n- Ensure that your application is capable of responding to the health check requests at the specified endpoint.\n- You can monitor the status of your container by navigating to the **Runtime** section under **DevOps** to confirm that it operates as expected.\n\nFor more detailed information, you can refer to the official documentation: [Set Up Health Checks](https://wso2.com/choreo/docs/devops-and-ci-cd/set-up-health-checks/#configure-liveness-and-readiness-probes)."
How can I use a personal access token (PAT) to automate deployments with the Choreo CLI?,"To use a personal access token (PAT) for authentication and automate deployments with the Choreo CLI, you need to connect your Git repository to Choreo using the PAT. This allows Choreo to perform actions on your behalf within the repository.\n\nHere's how you can do that:\n\n1. **Access the Choreo Console**: Ensure you are in the Choreo Console.\n\n2. **Select Your Organization**: In the Choreo Console header, go to the **Organization** list and select your organization.\n\n3. **Navigate to Settings**: In the left navigation menu, click on **Settings**. This will open the organization-level settings page.\n\n4. **Add Credentials**: \n   - Click on the **Credentials** tab.\n   - Click on **+Add Credentials** to configure the Git repository connection.\n   - Enter a **Credential Name**.\n   - Select your Git provider (such as Bitbucket or GitLab).\n   - Enter the **Personal Access Token** you obtained from your Git provider.\n   - Click **Save**.\n\nBy completing these steps, you authorize Choreo to access your Git repository using the PAT, allowing for automated deployments and other actions like triggering deployments and managing configurations.\n\nFor more detailed information, you can refer to the documentation [here](https://wso2.com/choreo/docs/develop-components/develop-components-with-git/#connect-a-git-repository-to-choreo)."
How do I revoke a personal access token in Choreo?,"To revoke a personal access token in the Choreo Console, you will need to use the appropriate API endpoint for revocation. Here’s a general guideline on how to handle the revocation of access tokens:\n\n1. **Understand Token Lifespan**: By default, the lifespan of the tokens is set to 15 minutes (900 seconds). It's advisable to keep the expiry time short to minimize security risks.\n\n2. **Revocation Process**: To revoke an access token, Choreo uses a mechanism that typically involves invoking a specific revoke endpoint for the token you wish to invalidate. This action is usually done programmatically through API calls rather than directly through the UI. \n\n3. **Use Short-lived Tokens**: Since revoking JWT tokens can be complex due to their self-validating nature, it's recommended to use short-lived access tokens and refresh them regularly to enhance security.\n\n4. **Caution on Revocation**: Once an API Key or a token is deleted or revoked, this action is irreversible. Ensure that you confirm the action, as any application depending on the revoked token will lose access immediately.\n\nFor detailed steps or specific API endpoint information, please refer to the documentation [here](https://wso2.com/choreo/docs/consuming-services/manage-application/#revoke-access-tokens). \n\nIf you need further assistance or specific endpoint details, feel free to ask!"
How do I configure a custom domain for the Developer Portal?,"To configure a custom domain for the Developer Portal in Choreo, you need to follow a series of steps in the Choreo Console. Ensure you have organization administrator privileges before proceeding. Here's how to do it:\n\n### Steps to Add a Custom Domain\n\n1. **Open the Choreo Console**: Since you are already in the console, proceed to the next step.\n   \n2. **Navigate to Organization Settings**:\n   - In the Choreo Console header, click on the **Organization** list.\n   - In the left navigation menu, click **Settings**. This opens the organization-level settings page.\n\n3. **Access URL Settings**:\n   - Click on the **URL Settings** tab.\n   - Then, go to the **Active Domains** tab.\n\n4. **Add a Custom Domain**:\n   - Click on **+ Add Domains**.\n   - In the **Add a Custom Domain** pane, enter your desired domain name.\n   - Select **Developer Portal** as the entity type. Note that the environment selection is not applicable for the Developer Portal.\n   - After that, the CNAME alias for the Developer Portal will be generated. Create a DNS record with your DNS provider to associate your domain name with the provided CNAME target value.\n\n5. **Verify the CNAME Mapping**:\n   - Once the DNS record is created, click the **Verify** button in the Choreo Console. It may take some time for the CNAME mapping to become globally available. If verification is successful, proceed to the next step.\n\n6. **Select a TLS Certificate Provider**:\n   - You can either import your own TLS certificates for the custom domain or select **Let's Encrypt** to allow Choreo to generate and manage the certificates for you.\n\n7. **Save the Custom Domain**:\n   - Finally, click **Add** to save the custom domain. Once added, the custom domain will be listed in the **Active Domains** tab under the URL **Settings** tab.\n\nUpon successful configuration, the custom domain will be immediately available for accessing the Developer Portal.\n\nFor more detailed information and visual guidance, you can refer to the documentation [here](https://wso2.com/choreo/docs/administer/configure-a-custom-domain-for-your-organization/#configure-a-custom-domain-for-an-organization)."
How can I customize the header and footer of the Developer Portal?,"To customize the header and footer of the Developer Portal in Choreo, you can follow these steps:\n\n1. **Access the Developer Portal Theme Settings**:\n   - Click on **Settings** in the left pane of the Choreo Console.\n   - In the header, select the **Organization** list to navigate to your organization's settings page.\n   - Click on the **API Management** tab, then select **Devportal Theme**.\n\n2. **Customize Header and Footer**:\n   - Once you are in the theme customization section, you will find options to modify various components of the portal, including the header and footer.\n   - Expand the relevant sections to access the customization options for the header and footer.\n   - Make your desired changes, such as updating text, colors, or logos.\n\n3. **Preview Changes**:\n   - After making changes, click the **Preview** button to see how the Developer Portal looks with your updates. This allows you to verify that your changes appear as intended.\n\n4. **Save and Go Live**:\n   - If you are satisfied with the changes, click **Save** to save your theme as a draft.\n   - To apply the changes to the Developer Portal, toggle the **Go Live** switch and confirm your action by clicking **Enable** in the popup message.\n\n5. **View Changes in the Developer Portal**:\n   - Finally, visit your Developer Portal to see the updated header and footer live on the site.\n\nPlease note that you need to be an admin user of the organization to customize the Developer Portal theme. Once you make changes, they cannot be undone, but you can reset to the default theme if needed.\n\nFor more detailed information, you can refer to the documentation [here](https://wso2.com/choreo/docs/administer/customize-the-developer-portal/)."
How do I add a new OAuth 2.0 grant type to my application in Asgardeo for use with Choreo?,"To add a new OAuth 2.0 grant type to your application in Asgardeo for integration with Choreo, you will need to configure an OIDC/OAuth 2.0 application in Asgardeo and ensure that it is linked correctly to your Choreo component. Here are the detailed steps you should follow:\n\n### Step 1: Create and Configure an OIDC/OAuth 2.0 Application in Asgardeo\n\n1. **Sign in to Asgardeo**: Go to [Asgardeo Console](https://console.asgardeo.io/).\n2. **Select Your Organization**: In the top navigation menu, click the **Organization** list and select your organization.\n3. **Create New Application**:\n   - Click **Applications** in the left navigation menu.\n   - Click **+ New Application** and choose **Standard-Based Application**.\n   - Specify a name for the application and select **OAuth2.0 OpenID Connect** as the protocol.\n   - Click **Register**.\n4. **Configure Protocol Settings**:\n   - Click the **Protocol** tab.\n   - Set the **Allowed grant types** based on your requirements (e.g., `Code`, `Refresh Token`).\n   - Add the following as **Authorized redirect URLs**:\n     - `[your-web-application-url]/auth/login/callback`\n     - `[your-web-application-url]/auth/logout/callback`\n   - Specify your web application URL under **Allowed origins**.\n   - In the **Access Token** section, select `JWT` as the **Token type**.\n   - Click **Update**.\n5. **Copy Client ID and Client Secret**: After the application is created, copy the **Client ID** and **Client Secret** as you will need these for the next step.\n\n### Step 2: Link the OIDC/OAuth 2.0 Application to Your Choreo Component\n\n1. **Go to Choreo Console**: In the Choreo Console, navigate to the component for which you want to manage OAuth keys.\n2. **Access Settings**:\n   - Click **Settings** in the left navigation menu.\n   - Click the **Authentication Keys** tab and select the environment where you want to generate keys.\n3. **Select Identity Provider**:\n   - In the **Identity Provider** list, select **Asgardeo - [your-org-name]**.\n4. **Add Keys**:\n   - Paste the **Client ID** and **Client Secret** from the Asgardeo application you created.\n   - Click **Add Keys** to complete the linking process.\n\n### Considerations\n\n- Ensure that you select the appropriate grant types based on the nature of your application (e.g., for user authentication, `Authorization Code` is usually recommended).\n- If you plan to invoke APIs secured with role-based access control, you will need to create roles in Asgardeo and map them accordingly.\n- Make sure to treat the `Client Secret` securely as it can grant access to your application.\n\nBy following these steps, you'll successfully add a new OAuth 2.0 grant type to your application in Asgardeo and integrate it with Choreo.\n\nFor further details, you can refer to the documentation links:\n- [Configure the identity provider for the web application](https://wso2.com/choreo/docs/authentication-and-authorization/secure-web-applications-with-managed-authentication/#step-3-configure-the-identity-provider-for-the-web-application)\n- [Manage Applications and Grant types](https://wso2.com/choreo/docs/consuming-services/manage-application/#grant-types)\n- [Secure API Access with Asgardeo](https://wso2.com/choreo/docs/authentication-and-authorization/secure-api-access-with-asgardeo/#step-4-invoke-the-choreo-api-with-scopes)"
How do I implement a custom API policy using Ballerina in Choreo?,"To implement a custom API policy using Ballerina in Choreo, follow these steps:\n\n### Prerequisites\n1. **Ballerina Installation**: Ensure that you have Ballerina version 2201.5.5 installed. You can download it from the [Ballerina website](https://ballerina.io/downloads/swan-lake-release-notes/swan-lake-2201.5.5).\n2. **Access Token Configuration**: Open the `~/.ballerina/settings.toml` file and configure an access token for Ballerina Central. You can generate a token from [Ballerina Central](https://central.ballerina.io/dashboard?tab=token) and copy the `Settings.toml` file to your local `~/.ballerina` directory or set it as an environment variable.\n\n### Step 1: Initialize a Ballerina Project\nUse the Choreo template to create a mediation policy project:\n```bash\nbal new -t choreo/mediation.template:1.0.0 <policy-name>\n```\nExample:\n```bash\nbal new -t choreo/mediation.template:1.0.0 validateHeader\n```\nThis will create a Ballerina project with the necessary configurations.\n\n### Step 2: Implement the Policy\nOpen the `policy.bal` file in your project and implement your policy. For instance, if you want to validate an incoming request header, you can modify the request and response stubs accordingly. \n\n#### Sample Implementation:\n**Request Flow**:\n```ballerina\n@mediation:RequestFlow\npublic function validateRequestHeader(mediation:Context ctx, http:Request req, string headerName, string headerValue) returns http:Response|false|error|() {\n    string|http:HeaderNotFoundError header = req.getHeader(headerName);\n    if (header is http:HeaderNotFoundError) {\n        string message = string `Header ${headerName} is not found`;\n        log:printError(message);\n        return generateResponse(message, http:STATUS_BAD_REQUEST);\n    }\n    if (header != headerValue) {\n        string validationFailedMessage = string `Header validation failed. Expected ${headerValue} but found ${header}`;\n        log:printError(validationFailedMessage);\n        return generateResponse(validationFailedMessage, http:STATUS_BAD_REQUEST);\n    }\n    log:printInfo(""Header validation successful"");\n    return ();\n}\n\nfunction generateResponse(string message, int statusCode) returns http:Response {\n    http:Response response = new();\n    response.setTextPayload(message);\n    response.statusCode = statusCode;\n    return response;\n}\n```\n\n**Response Flow**:\n```ballerina\n@mediation:ResponseFlow\npublic function validateResponseHeader(mediation:Context ctx, http:Request req, http:Response res, string headerName, string headerValue) returns http:Response|false|error|() {\n    string|http:HeaderNotFoundError header = res.getHeader(headerName);\n    if (header is http:HeaderNotFoundError) {\n        string message = string `Header ${headerName} is not found`;\n        log:printError(message);\n        return ();\n    }\n    if (header != headerValue) {\n        string validationFailedMessage = string `Header validation failed. Expected ${headerValue} but found ${header}`;\n        log:printError(validationFailedMessage);\n        return ();\n    }\n    return ();\n}\n```\n\n### Step 3: Publish the Policy\nOnce your policy is implemented, you need to publish it to Ballerina Central:\n1. Package the policy:\n   ```bash\n   bal pack\n   ```\n2. Publish the package:\n   ```bash\n   bal push\n   ```\n\n### Best Practices\n- Organize your source code within the default module and avoid adding additional modules.\n- Familiarize yourself with different return types of policy flows (like `http:Response`, `false`, `error`, and `()`).\n\nFor detailed information, you can refer to the documentation on how to [implement an API policy](https://wso2.com/choreo/docs/api-management/api-policies/#implement-an-api-policy) in Choreo."
How can I view the audit logs for my organization?,"To view the audit logs for your organization in Choreo, follow these steps:\n\n1. In the Choreo Console, navigate to the top navigation menu and click on **Organization**.\n2. In the left navigation menu, click on **DevOps** and then select **Audit Logs**. This will display the audit logs for the past 30 days by default.\n3. You can apply filter criteria to view audit logs based on a specific time range and other requirements.\n\nAudit logs in Choreo record organization-level user-specific operations, such as project and component creation, updates, and deletions, among others. The logs capture the timestamp and the outcome of each action. \n\nPlease note that only organization administrators can view audit logs by default. If other members need access, the administrator can create a role with the relevant permission and assign it to those members.\n\nFor more detailed instructions on managing audit log access, you can refer to the [Manage audit log access](https://wso2.com/choreo/docs/monitoring-and-insights/view-logs/#manage-audit-log-access) section.\n\nHere’s a visual reference for navigating to the audit logs:\n\n![Audit logs](https://wso2.com/choreo/docs/assets/img/monitoring-and-insights/view-logs/audit-logs.png)\n\nFor additional information on viewing logs, you can check the comprehensive guide [here](https://wso2.com/choreo/docs/monitoring-and-insights/view-logs/#audit-logs)."
How do I create a role that can only view audit logs?,"To create a role in Choreo that grants permissions to view audit logs, follow these steps:\n\n### Step 1: Create a Role with Audit Log Access Permission\n1. In the Choreo Console, go to the top navigation menu and click **Organization**.\n2. In the left navigation menu, click **Settings**.\n3. On the **Organization** tab, click **Roles** and then click **+ Create Role**.\n4. Enter a name and a description for the role.\n5. Click **Next**.\n6. In the **Create Role** dialog, select **LOG-MANAGEMENT** under **Permissions**.\n7. Click **Create**.\n\n### Step 2: Assign the Created Role to an Organization Member\n1. On the **Organization** tab, click **Members** to list the members of the organization.\n2. Click on the member who needs access to audit logs, and then click **+ Add Role**.\n3. Expand the **Roles** list and select the role you created in Step 1.\n4. Click **Add** to assign the selected role to the member.\n\nNow, the designated member will have access to view the audit logs.\n\nFor more details, you can refer to the documentation here: [Manage audit log access](https://wso2.com/choreo/docs/monitoring-and-insights/view-logs/#audit-logs)."
How can I troubleshoot issues related to scale-to-zero in Choreo?,"To troubleshoot issues related to the scale-to-zero feature in Choreo, you can follow these guidelines to identify and resolve common problems:\n\n### 1. **503 Status Code on First Request**\n   - It's common to encounter a 503 status code on the first request after deploying a component with scale-to-zero enabled. This usually happens because the readiness probe has default values that may not align with your application's needs. \n   - **Solution**: Adjust the readiness probe settings in the **DevOps** → **Health Checks** view to better fit your application.\n\n### 2. **Port Limitations**\n   - Ensure that your HTTP service runs on the specified ports for scale-to-zero to work. The supported ports are:\n     - 5000, 6000, 7000, 8000, 9000, 7070 to 7079, 8080 to 8089, and 9090 to 9099, or 8290.\n   - **Solution**: If your service is running on a different port, it will not automatically scale to zero. You may need to change the port or adjust your service configuration.\n\n### 3. **Scheduled Tasks and Component Connections**\n   - Scheduled tasks and manually triggered components cannot connect to a service on a project scope if scale-to-zero is enabled. This may result in errors like `Host not found, not forwarding request`.\n   - **Solution**: Set the task-type component to HPA mode (if on a paid plan) or to no scaling (if on the Developer plan).\n\n### 4. **Service Startup Time**\n   - After enabling scale-to-zero, the service should start within 60 seconds. If it does not, the gateway will timeout the request.\n   - **Solution**: Monitor the startup time and ensure that it is within the expected limit. If it consistently exceeds this duration, consider optimizing your service's startup process.\n\n### 5. **Component Deployment and Environment Configuration**\n   - Make sure that your component is deployed and ready to receive traffic before expecting it to scale to zero.\n   - **Solution**: Check the deployment status in the **Component Listing** pane and ensure that your settings are correctly applied in the **DevOps** → **Scaling** view.\n\nBy following these troubleshooting steps, you should be able to identify and resolve common issues related to the scale-to-zero feature in Choreo.\n\nFor more detailed guidance, please refer to the documentation [here](https://wso2.com/choreo/docs/devops-and-ci-cd/autoscale/autoscale-components-with-scale-to-zero/#troubleshooting)."
How do I configure resource limits for a manual task component?,"To set resource limits for a manual task component in Choreo, you can configure the default container settings associated with the component. Here are the steps to do this:\n\n1. In the Choreo Console, go to the **Overview** page of your manual task component.\n2. Look for the section that allows you to view and edit the container configuration, which includes resource limits.\n3. Set the resource limits according to your requirements. This includes specifying the memory and CPU limits. \n\n   - **Memory Limit**: If the process exceeds the allocated memory limit, the container will be forcefully shut down and restarted.\n   - **CPU Limit**: If the container exceeds the allocated CPU limit, it will be throttled, which may cause significant latencies in compute and I/O operations.\n\nBy setting these limits, you ensure that your manual task component does not consume more resources than necessary, which helps maintain the performance of other workloads on the data plane.\n\nFor more detailed instructions, you can refer to the documentation [here](https://wso2.com/choreo/docs/devops-and-ci-cd/configure-container-resources-commands-and-arguments/)."
