question,answer
How do I add build-time environment variables to a buildpack-based component?,"To add build-time environment variables to a buildpack-based component in Choreo, you can follow these steps:\n\n1. **Access the Component**: In the Choreo Console, navigate to the **Component Listing** pane and select the component you want to configure.\n\n2. **Open Build Configurations**: Go to the **Build** page of the selected component.\n\n3. **Use Build Configurations Editor**: Look for the **Build Configurations Editor** where you can configure the necessary environment variables for building your component.\n\n4. **Add Environment Variables**: Here, you can specify the build-time environment variables by defining the key-value pairs. It's important to note that these environment variables will be passed to the buildpack during the build process, thus allowing you to configure both buildpack-specific environment variables and those required for your component's build.\n\n5. **Example of Setting Variables**: For instance, if you want to override the default Maven command in a Java buildpack, you can set the environment variable `GOOGLE_MAVEN_BUILD_ARGS` with the value `clean install`.\n\nPlease note that the capability to configure build-time environment variables is not available for components created using **Ballerina** or **WSO2 MI** buildpacks.\n\nFor more detailed information, you can refer to the documentation [here](https://wso2.com/choreo/docs/develop-components/deploy-an-application-with-buildpacks/#develop-a-component)."
How do I configure file mounts for a Dockerfile-based component?,"To configure file mounts for a Dockerfile-based component in Choreo, follow the steps outlined below:\n\n1. **Select Your Component**: In the Choreo Console, navigate to the **Component Listing** pane and click on the component for which you want to define file mounts.\n\n2. **Access DevOps Settings**: In the left navigation menu, click on **DevOps**, and then select **Configs & Secrets**.\n\n3. **Create a New Config or Secret**: Click on **+ Create** to open the creation pane.\n\n4. **Select File Mount**: In the **Create a Config or Secret** pane, choose the option for **File Mount**.\n\n5. **Mark as Secret (Optional)**: If you want to create the file mount as a secret, check the option **Mark as a Secret**. Otherwise, you can proceed without marking it as a secret.\n\n   > **Note**: If marked as a secret, you won't be able to read the file content after creation.\n\n6. **Specify Display Name**: In the **Display Name** field, enter a name for the file mount. This name is just a reference for identification and does not affect the content.\n\n7. **Define File Mount Path**: In the **File Mount Path** field, specify where to mount the file inside the container using an absolute file path that includes the file name and extension if applicable.\n\n   > **Tip**: The file name in the mount path does not need to match the configuration name or the name of the file you upload.\n\n8. **Upload or Edit File Content**: Upload your configuration file or copy and paste the content into the editor.\n\n9. **Create the File Mount**: Click **Create** to finalize your configuration. \n\n   > **Note**: The configurations and secrets are applied immediately, and any existing running replicas will undergo a rolling restart to reflect the changes.\n\nFor more detailed information, you can refer to the official documentation: [Manage Configurations and Secrets](https://wso2.com/choreo/docs/devops-and-ci-cd/manage-configurations-and-secrets/#apply-a-file-mount-to-your-container)."
How do I use the Choreo CLI to describe a project?,"To describe a project using the Choreo CLI, you can utilize the appropriate command that is designed for this purpose. Although the specific command for describing a project isn't detailed in the documents provided, you can generally use the Choreo CLI commands to manage your projects.\n\nTypically, the command structure might look something like this:\n\n```sh\nchoreo project describe <project-name>\n```\n\nThis command would provide details about a specific project, including its components and configurations. If you're unsure of the exact command syntax, you can always check the help section of the CLI by running:\n\n```sh\nchoreo project --help\n```\n\nThis will give you information about all available commands and options related to projects in the Choreo CLI.\n\nFor more detailed information on the Choreo CLI and its commands, you can refer to the FAQ section [here](https://wso2.com/choreo/docs/references/faq/#choreo-cli)."
How do I configure a Tailscale auth key to automatically approve new nodes?,"I'm here to assist with questions related to Choreo. If your question is about integrating Tailscale with a service or platform within Choreo, please provide more details or clarify how it relates to Choreo. Otherwise, I won't be able to assist with non-Choreo related questions."
How can I secure my API with scopes using Choreo’s built-in security token service?,"To secure an API with scopes using Choreo’s built-in security token service, you can follow these steps:\n\n### Step 1: Assign Permissions to the API\n1. In the Choreo Console, navigate to your project.\n2. Select the component (API) for which you want to set permissions.\n3. Go to the **Deploy** section.\n4. Access the **Endpoint Configurations**.\n5. In the **Permissions List**, click **+ Add Permission(Scope)** and enter the desired permission value.\n6. Click **+ Add New** to add the permission.\n7. Copy the fully qualified name of the added permission for future reference.\n8. Attach the permissions to the respective resources by selecting from the **Select Permissions** list.\n9. Click **Apply**.\n10. Redeploy the component by going to **Configure & Deploy** and clicking **Deploy**.\n\nFor more detailed steps, you can refer to the documentation [here](https://wso2.com/choreo/docs/authentication-and-authorization/test-secure-api-access-with-choreo-built-in-security-token-service/#step-1-assign-permissions-to-an-api).\n\n### Step 2: Create Roles and Assign Permissions\n1. In the Choreo Console, navigate to **Settings**.\n2. Click on the **Application Security** tab.\n3. Click **+ Role**.\n4. Provide a **Role Name** and **Role Description**.\n5. Select the permissions you want to assign to the role and click **Create**.\n\nFor more details, refer to the documentation [here](https://wso2.com/choreo/docs/authentication-and-authorization/test-secure-api-access-with-choreo-built-in-security-token-service/#step-2-create-roles-and-assign-permissions).\n\n### Step 3: Assign Roles to User Groups\n1. Go to the **Organization** tab in the Choreo Console.\n2. Click on **Application Security** and then **Role Management**.\n3. Click **Map Groups** next to the role you want to assign.\n4. Specify the group name and save your changes.\n\nFor further information, check the documentation [here](https://wso2.com/choreo/docs/authentication-and-authorization/test-secure-api-access-with-choreo-built-in-security-token-service/#step-3-assign-roles-to-user-groups).\n\n### Conclusion\nBy following these steps, you can effectively secure your API with scopes using Choreo’s built-in security token service. This setup helps manage access control and ensures that only authorized users can invoke the API based on their assigned roles and permissions. \n\nFor a comprehensive overview of setting up security for APIs, refer to the main documentation [here](https://wso2.com/choreo/docs/authentication-and-authorization/test-secure-api-access-with-choreo-built-in-security-token-service/)."
How can I configure a continuous deployment pipeline with more than two environments?,"To configure a continuous deployment pipeline with multiple environments in Choreo, follow these steps:\n\n### Step 1: Create a New Continuous Deployment Pipeline\n1. Confirm that you have the `ENVIRONMENT-MANAGEMENT` permission, which is typically granted to roles such as Admin, Choreo Platform Engineer, and Choreo DevOps.\n2. In the Choreo Console, navigate to the **Organization** section and select your organization.\n3. Go to the **DevOps** section in the left navigation menu, and click on **CD Pipelines**.\n4. Click **+ Create Pipeline** and provide the necessary details:\n   - **Name**: Enter a display name for your new pipeline.\n   - **Mark as Default**: Choose this option if you want this pipeline to be the default for all new projects.\n5. Click **+ Add Environment** to include the required environments for your pipeline. You can specify the sequence in which these environments will be applied.\n6. Once you’ve added all desired environments, click **Create** to finalize the new pipeline.\n\n### Step 2: Edit Existing Continuous Deployment Pipeline (if needed)\nIf you need to modify an existing pipeline:\n1. Go to the **CD Pipelines** section as before.\n2. Click the edit icon next to the pipeline you wish to change.\n3. Update the pipeline name, default status, or the sequence of environments as needed.\n4. Click **Update** to save your changes.\n\n### Step 3: Add a Continuous Deployment Pipeline to a Project\nTo apply the created pipeline to a specific project:\n1. Select the project from the **Organization** section.\n2. Navigate to **DevOps** and then to **CD Pipelines**.\n3. Click **+ Add** and choose the pipelines you want to assign to the project.\n4. Click **Add** to finalize this action.\n\n### Important Notes\n- Choreo allows you to manage components across multiple environments using a **build once, deploy many** strategy. This means you create your services once and can promote them to different environments for testing or production.\n- Each environment can have its own configurations and secrets, ensuring a clean separation between code and environment-specific settings. \n\nFor further details, you can refer to the documentation here:\n- [Create a new continuous deployment pipeline](https://wso2.com/choreo/docs/devops-and-ci-cd/manage-continuous-deployment-pipelines/#create-a-new-continuous-deployment-pipeline)\n- [Add a continuous deployment pipeline to a project](https://wso2.com/choreo/docs/devops-and-ci-cd/manage-continuous-deployment-pipelines/#add-a-continuous-deployment-pipeline-to-a-project)"
How can I quickly deploy a sample REST API with OpenAPI definition in Choreo?,"To quickly deploy a sample REST API with an OpenAPI definition in Choreo, you can follow these steps:\n\n### Steps to Deploy a Sample REST API\n\n1. **Create an API Proxy**:\n   - If you don’t have any components in your project, click on **+ Create** to start.\n   - Select the **API Proxy** card, which opens the **Create an API Proxy** pane.\n   - Click on the **Create from Scratch** option.\n\n2. **Specify Proxy Metadata**:\n   - Fill in the following details:\n     - **Context**: This is a unique identifier for your API. For example, you might use `department-service`.\n     - **Version**: Define the version of your API, such as `v1.0`.\n     - **Target**: Provide the URL of the service you want to connect to. For example, you might use `https://samples.choreoapps.dev/company/hr`.\n\n3. **Component Details**:\n   - Enter the component details:\n     - **Component Display Name**: A user-friendly name for your API, e.g., `Department Service`.\n     - **Component Name**: This must be unique and cannot be changed after creation, e.g., `department-service`.\n     - **Description**: A brief description of what your API does, e.g., `Sample proxy for department service`.\n\n4. **Create the API Proxy**:\n   - Click on **Create**. This action will create the API proxy component and redirect you to the **Deploy** page.\n\n5. **Post-deployment Actions**:\n   - To test the deployed service, navigate to the **Test Console** in the Choreo Console UI.\n\nFollowing these steps will help you set up and deploy a sample REST API quickly. For detailed guidance, you can refer to the official documentation: [Develop an API Proxy from Scratch](https://wso2.com/choreo/docs/develop-components/develop-proxy/develop-an-api-proxy-from-scratch/#step-1-create-an-api-proxy)."
How can I generate access tokens for API testing in the Choreo Developer Portal?,"To generate an access token for API testing in the Choreo Developer Portal, follow these detailed steps:\n\n### Prerequisites\nBefore you begin, ensure you have the following:\n1. An application created in the [Choreo Developer Portal](https://devportal.choreo.dev).\n2. Keys generated for the application.\n3. Subscriptions created for the APIs you want to access.\n\n### Steps to Generate an Access Token\n1. **Access the Applications Section**:\n   - In the header of the Choreo Developer Portal, click on **Applications**.\n\n2. **Select Your Application**:\n   - On the **My Applications** page, click on the application for which you want to generate keys and tokens.\n\n3. **Navigate to Credentials**:\n   - In the left navigation menu, click on the desired environment under **Credentials**. This will open the **Application Keys** pane for that environment.\n\n4. **Generate the Token**:\n   - Click **Generate Token** to create a test access token.\n\nAfter following these steps, you will have an access token that you can use for testing API calls.\n\nFor more information, you can refer to the detailed documentation here: [Generate an Access Token via the Developer Portal UI (for testing)](https://wso2.com/choreo/docs/consuming-services/generate-an-access-token/#generate-an-access-token-via-the-developer-portal-ui-for-testing)."
How do I configure a custom domain for a scheduled task?,"To configure a custom domain for a scheduled task in Choreo, you'll need to follow a two-step process: adding the custom domain at the organizational level and then requesting a custom URL for your scheduled task.\n\n### Step 1: Add a Custom Domain for Your Organization\n\n1. Ensure you have organization administrator privileges.\n2. In the Choreo Console header, click the **Organization** list.\n3. In the left navigation menu, click **Settings** to open the organization-level settings page.\n4. Click the **URL Settings** tab and then the **Active Domains** tab.\n5. Click **+ Add Domains**.\n6. In the **Add a Custom Domain** pane:\n   - Enter your custom domain name.\n   - Select the environment to apply the domain name.\n   - Choose the appropriate entity type (e.g., API, Web App).\n7. Note the generated CNAME target value and create a DNS record with your DNS provider.\n8. Once the DNS record is created, click **Verify** to check the CNAME mapping.\n9. After successful verification, click **Next** and select a TLS certificate provider.\n10. Finally, click **Add** to save the custom domain.\n\nOnce your custom domain is added, it will be available for use.\n\n### Step 2: Request a Custom URL for Your Scheduled Task\n\n1. Make sure your scheduled task is deployed to the specific environment where you want to configure the custom URL.\n2. In the **Component Listing** pane, select your scheduled task.\n3. Click **Settings** in the left navigation menu.\n4. Go to the **URL Settings** tab, where you'll see the active deployments and whether a custom URL is configured.\n5. If a custom domain is available, click the **Edit URL Mapping** icon for the respective environment.\n6. In the **URL Settings** dialog:\n   - Select your custom domain from the dropdown.\n   - Specify the path for the scheduled task if required.\n7. Click **Configure** to create the custom URL mapping, which will be pending until an administrator approves it.\n\n### Approving the Custom URL Request\n\nAs an administrator, you can approve the custom URL request by going to the **Pending URL Requests** tab under **URL Settings** and clicking the **Approve URL Mapping** icon next to the request you wish to approve.\n\nOnce approved, your scheduled task will be accessible via the configured custom URL.\n\nFor detailed instructions on adding a custom domain and requesting a custom URL, you can refer to the [Choreo documentation on configuring a custom domain for your organization](https://wso2.com/choreo/docs/administer/configure-a-custom-domain-for-your-organization/)."
How can I switch between different projects within the VS Code extension?,"I'm here to help with questions related to Choreo. If your question is related to switching projects within the Choreo VS Code extension or any other aspect of Choreo, please provide more details or clarify your question. If it's not related to Choreo, I won't be able to assist with it."
How do I link a local directory to an existing Choreo project using the VS Code extension?,"To link a local directory to an existing Choreo project using the VS Code extension, follow these steps:\n\n1. **Open the VS Code Extension**: Ensure you have the Choreo extension installed in your Visual Studio Code environment.\n\n2. **Connect to Your Choreo Project**: Use the extension to connect to your existing Choreo project. This typically involves selecting the project from a list of your existing projects.\n\n3. **Link the Local Directory**: \n   - From the VS Code interface, you should have an option to associate or link a local directory with your Choreo project. This might be a feature in the command palette or a specific button in the Choreo extension sidebar.\n   - Select the local directory that contains your project files. This directory should contain the relevant code and configuration files for your Choreo components.\n\n4. **Initialize the Connection**: Once the local directory is linked, the extension will often prompt you to initialize the connection by setting up necessary configurations or files that allow your local code to sync with the Choreo project.\n\n5. **Confirm the Link**: After linking, ensure that the local changes you make in the directory are reflected in your Choreo project. This may involve committing changes to a Git repository if your project is version-controlled.\n\nFor more detailed instructions or specific commands, you may refer to the [Choreo documentation on developing components with Git](https://wso2.com/choreo/docs/develop-components/develop-components-with-git/#connect-a-git-repository-to-choreo). \n\nThis documentation will provide you with insights on how to effectively manage your Git repositories within Choreo, including linking and syncing your local development environment."
How do I add a new project association to a context.yaml file using the VS Code extension?,"To add a new project association to a `context.yaml` file using the Choreo VS Code extension, follow these steps:\n\n1. **Open your VS Code project**: Ensure you have your project opened in VS Code where the `context.yaml` file is located.\n\n2. **Locate the `context.yaml` file**: Navigate to the directory containing the `context.yaml` file in your project.\n\n3. **Edit the `context.yaml` file**: Open the `context.yaml` file for editing. You will need to add a new project association in the appropriate format. Typically, this involves specifying the project name, identifier, and any other relevant details in YAML format.\n\n4. **Add the new project association**: Insert the new project details under the relevant section in the `context.yaml` file. The structure may look like this:\n\n   ```yaml\n   projects:\n     - name: your_project_name\n       id: your_project_id\n       # Other relevant properties\n   ```\n\n5. **Save your changes**: After adding the new project association, make sure to save the `context.yaml` file.\n\n6. **Deploy your changes**: After saving the file, you may need to deploy your changes using the Choreo VS Code extension functionalities to ensure that the new association is recognized in the Choreo environment.\n\nFor detailed guidance on using the Choreo VS Code extension, please refer to the official documentation. Unfortunately, I do not have specific steps regarding the usage of the Choreo VS Code extension in the provided documents. For more information, you might want to explore the Choreo documentation directly."
How can I add a third-party service as a dependency to my project?,"To add a third-party service as a dependency to your Choreo project, you need to register the service in the Choreo Console. Here’s a step-by-step guide to help you with the process:\n\n### Step 1: Register the Third-Party Service\n\n1. **Select the Level of Registration**:\n   - Decide whether to register the service at the **Organization level** (accessible from any project within the organization) or at the **Project level** (restricted to a specific project).\n\n2. **Access the Dependencies Section**:\n   - In the left navigation menu, click on **Dependencies** and then select **Third-Party Services**.\n\n3. **Register the Service**:\n   - Click on **+ Register**.\n   - Provide the necessary details for the service:\n     - **Name**: Enter a name for your service.\n     - **Version**: Specify the version of the service.\n     - **Service Definition File**: Upload the service definition file (e.g., OpenAPI or GraphQL schema). This will automatically detect the service type.\n     - **Verify the Service Type**: Ensure the correct service type is displayed.\n\n4. **Define Endpoints**:\n   - Click **Define Endpoints** to proceed to define the service endpoints, which include the parameters required to connect to the service (like the service URL, API key, etc.).\n\n### Step 2: Define Service Endpoints\n\n1. **Create the Endpoint**:\n   - Under **Define New Endpoint**, enter:\n     - **Name**: Specify a name for the endpoint.\n     - **Endpoint URL**: Provide the endpoint URL.\n   \n2. **Add Additional Parameters**:\n   - Include any other parameters required for the connection, such as API keys or authorization tokens. You can mark parameters as ""Secret"" for confidentiality.\n\n3. **Select Environments**:\n   - Choose the environments where the endpoint should be accessible. This determines where service consumers can create connections to the endpoint.\n\n4. **Complete the Registration**:\n   - Click **OK** after defining the endpoint. If you have more endpoints to add, click **+ New Endpoint** and repeat the process.\n   - Finally, click **Register** to finalize the registration of the service.\n\nOnce registered, the service will be available in the Internal Marketplace and can be consumed via a Connection.\n\n### Important Notes:\n- Ensure you have all the necessary details from the service provider before you start the registration process, such as the service URL and API specifications.\n- If you want to manage the service later, you can view or update details from the **Third-Party Services** list.\n\nFor more detailed information, you can refer to the documentation on [registering a third-party service in Choreo](https://wso2.com/choreo/docs/integrate-and-manage-external-services/integrate-and-manage-third-party-services/#register-a-third-party-service-in-choreo)."
How do I configure a connection to an external service using mutual TLS?,"To configure a connection to an external service using mutual TLS in Choreo, follow these steps:\n\n### 1. Generate Certificates\nYou need to create the following certificates for mutual TLS:\n\n- **Root Certificate**: This certificate is trusted by both the client and server. It is used to verify the authenticity of other certificates during the mutual TLS handshake and to issue certificates for clients and servers. You can generate this using a tool like OpenSSL.\n\n- **Client Certificate**: This certificate authenticates the client. The Common Name (CN) in the certificate identifies the client and must be signed by the root certificate.\n\n- **Server Certificate**: This certificate is used by clients to verify the server’s trustworthiness. Similar to the client certificate, it must be signed by the root certificate. When generating the server certificate, specify the server's hostname for the Subject Alternative Name (SAN). You can get this hostname from the project endpoint on the Overview page. \n\n### 2. Configure Mutual TLS\nOnce you have your certificates ready, configure mutual TLS for your service connections. Mutual TLS ensures that both the client and server validate each other's certificates before establishing a connection, thereby enhancing security.\n\n### 3. Read Certificates in Components\nEach component can read the mutual TLS certificates from the file system or via environment variables. Ensure that your private key is saved as a secret for security.\n\n### Additional Resources\nFor a more detailed understanding and a sample implementation, you can refer to the following documents:\n- [Configure Mutual TLS Between Components](https://wso2.com/choreo/docs/authentication-and-authorization/configure-mutual-tls-between-components/)\n- [Secure Communication Between the Choreo Gateway and Your Backend with Mutual TLS](https://wso2.com/choreo/docs/authentication-and-authorization/secure-communication-between-the-choreo-gateway-and-your-backend-with-mutual-tls/)\n  \nThese resources will provide you with a comprehensive guide to setting up mutual TLS connections effectively in Choreo."
